id,address,postcode,public_body,removal_proposal_sent,public_body_representation_made,bt_initial_decision,bt_initial_decision_date,public_body_review_requested,bt_final_decision,bt_final_decision_date,latitude,longitude,geocoded_postcode,geocoding_status
1590,Junction Of Sion Hill Cavendish Road Bath,BA1 2UD,Bath and North East Somerset,24/02/2025,No,Remove,02/06/2025,No,Remove,02/06/2025,51.391852,-2.368582,BA1 2UD,ok
1591,St Stephens Church Lansdown Road Bath,BA1 5SY,Bath and North East Somerset,24/02/2025,No,Remove,02/06/2025,No,Remove,02/06/2025,51.395396,-2.365333,BA1 5SY,ok
1592,Bathwick Hill Bath,BA2 6EW,Bath and North East Somerset,24/02/2025,No,Remove,02/06/2025,No,Remove,02/06/2025,51.379754,-2.343569,BA2 6EW,ok
1593,Outside 3 Bristol Road Keynsham Bristol,BS31 2BA,Bath and North East Somerset,24/02/2025,No,Remove,02/06/2025,No,Remove,02/06/2025,51.417638,-2.500471,BS31 2BA,ok
1594,At Hinton Blewett Village Lower Road Hinton Blewett Bristol,BS39 5AT,Bath and North East Somerset,24/02/2025,Yes,Remove,02/06/2025,No,Remove,02/06/2025,51.307243,-2.585992,BS39 5AT,ok
1595,Adjacent Church Coastguard Lane Parkgate Neston,CH64 6SP,Cheshire West and Chester (B),25/02/2025,No,Remove,02/06/2025,No,Remove,02/06/2025,53.296309,-3.082676,CH64 6SP,ok
1596,Outside Lloyds Bank Ltd Church Street Malpas,SY14 8NX,Cheshire West and Chester (B),25/02/2025,No,Remove,02/06/2025,No,Remove,02/06/2025,53.019884,-2.766137,SY14 8NX,ok
1597,Mill Lane Coddington Chester,CH3 9EN,Cheshire West and Chester (B),25/02/2025,Yes,Remove,02/06/2025,Yes,Retain,31/07/2025,53.090197,-2.820276,CH3 9EN,ok
1598,Irons Lane Great Barrow Chester,CH3 7LD,Cheshire West and Chester (B),25/02/2025,No,Remove,02/06/2025,No,Remove,02/06/2025,53.216626,-2.783422,CH3 7LD,ok
1599,Barrow Lane Great Barrow Chester,CH3 7HW,Cheshire West and Chester (B),25/02/2025,No,Remove,02/06/2025,No,Remove,02/06/2025,53.205515,-2.801037,CH3 7HW,ok
1600,Opposite The Church Church Street Tarvin Chester,CH3 8EB,Cheshire West and Chester (B),25/02/2025,No,Remove,02/06/2025,No,Remove,02/06/2025,53.197047,-2.762692,CH3 8EB,ok
1601,Huxley Lane Tiverton Tarporley,CW6 9NB,Cheshire West and Chester (B),25/02/2025,No,Remove,02/06/2025,No,Remove,02/06/2025,53.139025,-2.671358,CW6 9NB,ok
1602,Junction Of Warrington Road Norley Road Cuddington Northwich,CW8 2LE,Cheshire West and Chester (B),25/02/2025,No,Remove,02/06/2025,No,Remove,02/06/2025,53.239319,-2.599866,CW8 2LE,ok
1603,Station Road Winsford,CW7 3DQ,Cheshire West and Chester (B),25/02/2025,No,Remove,02/06/2025,No,Remove,02/06/2025,53.190705,-2.505196,CW7 3DQ,ok
1604,O S Po Junction Of Mill Lane Burton Road Little Neston Neston,CH64 4AE,Cheshire West and Chester (B),25/02/2025,No,Remove,02/06/2025,No,Remove,02/06/2025,53.283086,-3.056618,CH64 4AE,ok
1605,Near Millers Kitchen Liverpool Road Chester,CH2 1AU,Cheshire West and Chester (B),25/02/2025,Yes,Remove,02/06/2025,No,Remove,02/06/2025,53.209039,-2.894566,CH2 1AU,ok
1606,Gt Mollington Church Lane Backford Chester,CH2 4BE,Cheshire West and Chester (B),25/02/2025,No,Remove,02/06/2025,No,Remove,02/06/2025,53.238775,-2.901718,CH2 4BE,ok
1607,Handbridge Overleigh Road Chester,CH4 7HL,Cheshire West and Chester (B),25/02/2025,No,Remove,02/06/2025,No,Remove,02/06/2025,53.182287,-2.88973,CH4 7HL,ok
1608,Eccleston C Of E Aided Primary School Eaton Road Eccleston Chester,CH4 9HD,Cheshire West and Chester (B),25/02/2025,No,Remove,02/06/2025,No,Remove,02/06/2025,53.157444,-2.880856,CH4 9HD,ok
1609,Upton Heath P O Long Lane Chester,CH2 2PF,Cheshire West and Chester (B),25/02/2025,No,Remove,02/06/2025,No,Remove,02/06/2025,53.210187,-2.864373,CH2 2PF,ok
1610,Weston Grove Upton Heath Weston Grove Upton Chester,CH2 1QH,Cheshire West and Chester (B),25/02/2025,Yes,Remove,02/06/2025,No,Remove,02/06/2025,53.21691,-2.876864,CH2 1QH,ok
1611,Blacon Avenue Blacon Chester,CH1 5BX,Cheshire West and Chester (B),25/02/2025,No,Remove,02/06/2025,No,Remove,02/06/2025,53.207384,-2.920584,CH1 5BX,ok
1612,Shopping Precinct Green Lane Vicars Cross Chester,CH3 5LA,Cheshire West and Chester (B),25/02/2025,No,Remove,02/06/2025,No,Remove,02/06/2025,53.194568,-2.856381,CH3 5LA,ok
1613,Panton Road Hoole Chester,CH2 3HY,Cheshire West and Chester (B),25/02/2025,No,Remove,02/06/2025,No,Remove,02/06/2025,53.199476,-2.872541,CH2 3HY,ok
1614,Stainbeck Rd Scott Hall Rd Leeds,LS7 2LR,Leeds District (B),25/02/2025,No,Remove,25/02/2025,No,Remove,25/02/2025,53.833039,-1.545228,LS7 2LR,ok
1615,Outside Railway Station 1 Hooton Road Hooton Ellesmere Port,CH66 7NL,Cheshire West and Chester (B),25/02/2025,Yes,Remove,02/06/2025,No,Remove,02/06/2025,53.29819,-2.974105,CH66 7NL,ok
1616,Outside Sub Post Office Saighton Lane Saighton Chester,CH3 6EG,Cheshire West and Chester (B),25/02/2025,Yes,Remove,02/06/2025,Yes,Retain,30/07/2025,53.153442,-2.832398,CH3 6EG,ok
1617,Nt Junction Of Holgate Drive Colley Road Sheffield,S5 9GZ,Sheffield District (B),25/02/2025,Yes,Remove,03/06/2025,No,Remove,03/06/2025,53.430301,-1.468859,S5 9GZ,ok
1618,Attercliffe Road Shortridge Street Sheffield,S9 3QS,Sheffield District (B),25/02/2025,No,Remove,03/06/2025,No,Remove,03/06/2025,53.392728,-1.433282,S9 3QS,ok
1619,Junction Carlisle Rd Carlisle Street East Sheffield,S4 7QN,Sheffield District (B),25/02/2025,No,Remove,03/06/2025,No,Remove,03/06/2025,53.395329,-1.449488,S4 7QN,ok
1620,Near Junction Of Margate Drive Whiteways Drive Sheffield,S4 8ET,Sheffield District (B),25/02/2025,No,Remove,03/06/2025,No,Remove,03/06/2025,53.404686,-1.445472,S4 8ET,ok
1621,Near Junction Mickley Lane Baslow Road Sheffield,S17 4DT,Sheffield District (B),25/02/2025,No,Remove,03/06/2025,No,Remove,03/06/2025,53.315353,-1.533073,S17 4DT,ok
1622,Junction Heads Lane Walders Lane Bolsterstone Sheffield,S36 3ZH,Sheffield District (B),25/02/2025,No,Remove,03/06/2025,No,Remove,03/06/2025,53.467532,-1.592732,S36 3ZH,ok
1623,Lucton Kingsland Leominster,HR6 9SG,County of Herefordshire,26/02/2025,No,Remove,03/06/2025,No,Remove,03/06/2025,52.247266,-2.815899,HR6 9SG,ok
1624,Pelton Fell Rd Opposite Surgery 1 Fell Road Pelton Fell Chester Le Street,DH2 2NR,County Durham,26/02/2025,No,Remove,03/06/2025,No,Remove,03/06/2025,54.857435,-1.608311,DH2 2NR,ok
1625,Opposite No 19 Blackhills Road Horden Peterlee,SR8 4DW,County Durham,26/02/2025,No,Remove,03/06/2025,No,Remove,03/06/2025,54.765452,-1.313392,SR8 4DW,ok
1626,Outside Bell Hotel Sunderland Road Horden Peterlee,SR8 4PF,County Durham,26/02/2025,No,Remove,03/06/2025,No,Remove,03/06/2025,54.766717,-1.321002,SR8 4PF,ok
1627,Westfield P.O. Grandstand Road Hereford,HR4 9NR,County of Herefordshire,26/02/2025,No,Remove,03/06/2025,No,Remove,03/06/2025,52.069975,-2.736888,HR4 9NR,ok
1628,College Road Hereford,HR1 1EE,County of Herefordshire,26/02/2025,No,Remove,03/06/2025,No,Remove,03/06/2025,52.065877,-2.710299,HR1 1EE,ok
1629,Sub Office Kings Pyon Hereford,HR4 8PS,County of Herefordshire,26/02/2025,No,Remove,03/06/2025,No,Remove,03/06/2025,52.150366,-2.822019,HR4 8PS,ok
1630,Credenhill Hereford,HR4 7DL,County of Herefordshire,26/02/2025,No,Remove,03/06/2025,No,Remove,03/06/2025,52.090136,-2.803748,HR4 7DL,ok
1631,The Avenue Chester Le Street,DH2 2DD,County Durham,26/02/2025,No,Remove,03/06/2025,No,Remove,03/06/2025,54.855031,-1.582696,DH2 2DD,ok
1632,Opposite Cedar Rise Hoarwithy Hereford,HR2 6QQ,County of Herefordshire,26/02/2025,No,Remove,03/06/2025,No,Remove,03/06/2025,51.962488,-2.661275,HR2 6QQ,ok
1633,Shucknall Hereford,HR1 3SJ,County of Herefordshire,26/02/2025,No,Remove,03/06/2025,No,Remove,03/06/2025,52.079847,-2.604433,HR1 3SJ,ok
1634,Hampton Bishop Hereford,HR1 4JR,County of Herefordshire,26/02/2025,No,Remove,03/06/2025,No,Remove,03/06/2025,52.039856,-2.656454,HR1 4JR,ok
1635,St. Martins Avenue Hereford,HR2 7RQ,County of Herefordshire,26/02/2025,No,Remove,03/06/2025,No,Remove,03/06/2025,52.050764,-2.717716,HR2 7RQ,ok
1636,Outside 2 Prospect Terrace Shincliffe Durham,DH1 2NR,County Durham,26/02/2025,Yes,Retain,03/06/2025,No,Retain,03/06/2025,54.759948,-1.548164,DH1 2NR,ok
1637,K27243 Outside Walker House Ovington Richmond,DL11 7BP,County Durham,26/02/2025,No,Remove,03/06/2025,No,Remove,03/06/2025,54.527166,-1.799267,DL11 7BP,ok
1638,Nr Ivy Holme Cottage Romaldkirk Barnard Castle,DL12 9DZ,County Durham,26/02/2025,Yes,Retain,03/06/2025,No,Retain,03/06/2025,54.593357,-2.011892,DL12 9DZ,ok
1639,Mordiford Hereford,HR1 4LW,County of Herefordshire,26/02/2025,No,Remove,03/06/2025,No,Remove,03/06/2025,52.033109,-2.625786,HR1 4LW,ok
1640,Junction Dodds Terrace Salters Lane Wingate,TS28 5BN,County Durham,26/02/2025,No,Remove,03/06/2025,No,Remove,03/06/2025,54.735089,-1.380685,TS28 5BN,ok
1641,Opposite 15&16 Rockingham Road Sunnybrow Crook,DL15 0NN,County Durham,26/02/2025,No,Remove,03/06/2025,No,Remove,03/06/2025,54.704217,-1.697093,DL15 0NN,ok
1642,Outside Post Office Front Street Ebchester Consett,DH8 0PJ,County Durham,26/02/2025,No,Remove,03/06/2025,No,Remove,03/06/2025,54.89343,-1.841046,DH8 0PJ,ok
1643,Outside The Post Office Market Place Tetbury,GL8 8DA,Cotswold District,26/02/2025,No,Remove,02/06/2025,No,Remove,02/06/2025,51.636709,-2.158646,GL8 8DA,ok
1644,Daylesford Moreton-In-Marsh,GL56 0YG,Cotswold District,26/02/2025,No,Remove,02/06/2025,No,Remove,02/06/2025,51.928815,-1.643084,GL56 0YG,ok
1645,Turkdean Cheltenham,GL54 3NT,Cotswold District,26/02/2025,No,Remove,02/06/2025,No,Remove,02/06/2025,51.855421,-1.846415,GL54 3NT,ok
1646,Fosseway Stow On The Wold Cheltenham,GL54 1DW,Cotswold District,26/02/2025,Yes,Remove,24/07/2025,No,Retain,24/07/2025,51.93102,-1.724324,GL54 1DW,ok
1647,High Street Mickleton Chipping Campden,GL55 6RX,Cotswold District,26/02/2025,No,Remove,02/06/2025,No,Remove,02/06/2025,52.08991,-1.767381,GL55 6RX,ok
1648,Bagendon Cirencester,GL7 7DU,Cotswold District,26/02/2025,No,Remove,02/06/2025,No,Remove,02/06/2025,51.758901,-1.990179,GL7 7DU,ok
1649,At Old Post Office Coates Lane Coates Cirencester,GL7 6JU,Cotswold District,26/02/2025,No,Remove,02/06/2025,No,Remove,02/06/2025,51.708592,-2.029237,GL7 6JU,ok
1650,Sapperton Cirencester,GL7 6LE,Cotswold District,26/02/2025,No,Remove,02/06/2025,No,Remove,02/06/2025,51.727299,-2.076449,GL7 6LE,ok
1651,Pelton Lane Pelton Chester Le Street,DH2 1HZ,County Durham,26/02/2025,No,Remove,03/06/2025,No,Remove,03/06/2025,54.872752,-1.598828,DH2 1HZ,ok
1652,Garbrook Cl Est Tarrington Hereford,HR1 4EX,County of Herefordshire,26/02/2025,No,Remove,03/06/2025,No,Remove,03/06/2025,52.062517,-2.563677,HR1 4EX,ok
1653,Upper Road Eastnor Ledbury,HR8 1RB,County of Herefordshire,26/02/2025,No,Remove,03/06/2025,No,Remove,03/06/2025,52.033973,-2.392763,HR8 1RB,ok
1654,Huntington Kington,HR5 3PY,County of Herefordshire,26/02/2025,No,Remove,03/06/2025,No,Remove,03/06/2025,52.175817,-3.099219,HR5 3PY,ok
1655,Nr 40A High Street Markyate St. Albans,AL3 8PB,Dacorum District (B),26/02/2025,No,Remove,03/06/2025,No,Remove,03/06/2025,51.837581,-0.462399,AL3 8PB,ok
1656,Pier Road Greenhithe,DA9 9NS,Dartford District (B),26/02/2025,No,Remove,03/06/2025,No,Remove,03/06/2025,51.453533,0.284103,DA9 9NS,ok
1657,Jctn Station Road 1 Orchard Lea Westwood Road Southfleet Gravesend,DA13 9LT,Dartford District (B),26/02/2025,No,Remove,03/06/2025,No,Remove,03/06/2025,51.419799,0.307564,DA13 9LT,ok
1658,P High Street Everdon Daventry,NN11 3BL,Daventry District,26/02/2025,No,Remove,03/06/2025,No,Remove,03/06/2025,52.212815,-1.132787,NN11 3BL,ok
1659,Old Forge Lane/ High Street Preston Capes Daventry,NN11 3TB,Daventry District,26/02/2025,Yes,Retain,03/06/2025,No,Retain,03/06/2025,52.187973,-1.158898,NN11 3TB,ok
1660,Main Street Draughton Northampton,NN6 9JQ,Daventry District,26/02/2025,No,Remove,03/06/2025,No,Remove,03/06/2025,52.383654,-0.88236,NN6 9JQ,ok
1661,Junction Hudnall Lane Nettleden Road Little Gaddesden Berkhamsted,HP4 1PP,Dacorum District (B),26/02/2025,No,Remove,03/06/2025,No,Remove,03/06/2025,51.793802,-0.542294,HP4 1PP,ok
1662,Church Rd/ Holdenby Northampton,NN6 8DJ,Daventry District,26/02/2025,Yes,Retain,03/06/2025,No,Retain,03/06/2025,52.304435,-0.981403,NN6 8DJ,ok
1663,Winwick Northampton,NN6 7PD,Daventry District,26/02/2025,No,Remove,03/06/2025,No,Remove,03/06/2025,52.358684,-1.081126,NN6 7PD,ok
1664,Guilsborough Road West Haddon Northampton,NN6 7AD,Daventry District,26/02/2025,Yes,Retain,03/06/2025,No,Retain,03/06/2025,52.342095,-1.071796,NN6 7AD,ok
1665,Clay Coton Northampton,NN6 6JU,Daventry District,26/02/2025,No,Remove,03/06/2025,No,Remove,03/06/2025,52.387562,-1.128782,NN6 6JU,ok
1666,High Street Braunston Daventry,NN11 7HR,Daventry District,26/02/2025,No,Remove,03/06/2025,No,Remove,03/06/2025,52.291659,-1.207726,NN11 7HR,ok
1667,High Street Clipston Market Harborough,LE16 9RU,Daventry District,26/02/2025,No,Remove,03/06/2025,No,Remove,03/06/2025,52.427341,-0.953219,LE16 9RU,ok
1668,Church Street Sibbertoft Market Harborough,LE16 9UA,Daventry District,26/02/2025,No,Remove,03/06/2025,No,Remove,03/06/2025,52.437144,-0.999207,LE16 9UA,ok
1669,Old Spo Broughton Road Old Northampton,NN6 9RH,Daventry District,26/02/2025,No,Remove,03/06/2025,No,Remove,03/06/2025,52.352207,-0.843393,NN6 9RH,ok
1670,Junction Wainbody Ave South Leasowes Avenue Coventry,CV3 6BH,Coventry District (B),26/02/2025,No,Remove,03/06/2025,No,Remove,03/06/2025,52.380222,-1.535727,CV3 6BH,ok
1671,Walford Road Ross-On-Wye,HR9 5PY,County of Herefordshire,26/02/2025,No,Remove,03/06/2025,No,Remove,03/06/2025,51.903501,-2.587936,HR9 5PY,ok
1672,Coughton Ross-On-Wye,HR9 5SE,County of Herefordshire,26/02/2025,No,Remove,03/06/2025,No,Remove,03/06/2025,51.889053,-2.587937,HR9 5SE,ok
1673,Staunton Green Staunton-On-Arrow Leominster,HR6 9LE,County of Herefordshire,26/02/2025,No,Remove,03/06/2025,No,Remove,03/06/2025,52.24502,-2.934438,HR6 9LE,ok
1674,Pembridge Leominster,HR6 9HY,County of Herefordshire,26/02/2025,No,Remove,03/06/2025,No,Remove,03/06/2025,52.219453,-2.905225,HR6 9HY,ok
1675,Walford Craven Arms,SY7 0JT,County of Herefordshire,26/02/2025,No,Remove,03/06/2025,No,Remove,03/06/2025,52.346997,-2.896728,SY7 0JT,ok
1676,In Lamb Inn Car Park Stoke Prior Leominster,HR6 0NB,County of Herefordshire,26/02/2025,No,Remove,03/06/2025,No,Remove,03/06/2025,52.207066,-2.703269,HR6 0NB,ok
1677,Upper Lye Wigmore Leominster,HR6 9UL,County of Herefordshire,26/02/2025,No,Remove,03/06/2025,No,Remove,03/06/2025,52.313426,-2.859259,HR6 9UL,ok
1678,Orlin Road Colwall Malvern,WR13 6HA,County of Herefordshire,26/02/2025,No,Remove,03/06/2025,No,Remove,03/06/2025,52.08365,-2.366638,WR13 6HA,ok
1679,Walwyn Road Colwall Malvern,WR13 6QP,County of Herefordshire,26/02/2025,No,Remove,03/06/2025,No,Remove,03/06/2025,52.079898,-2.358946,WR13 6QP,ok
1680,Jubilee Drive Upper Colwall Malvern,WR13 6DW,County of Herefordshire,26/02/2025,No,Remove,03/06/2025,No,Remove,03/06/2025,52.063592,-2.345658,WR13 6DW,ok
1681,Market Hall New Road Bromyard,HR7 4AH,County of Herefordshire,26/02/2025,No,Remove,03/06/2025,No,Remove,03/06/2025,52.189162,-2.508081,HR7 4AH,ok
1682,Nr Bringsty Forge Bromyard Road Bringsty Worcester,WR6 5TA,County of Herefordshire,26/02/2025,No,Remove,03/06/2025,No,Remove,03/06/2025,52.188805,-2.452111,WR6 5TA,ok
1683,Birchwood Junction Storridge Malvern,WR13 5HB,County of Herefordshire,26/02/2025,No,Remove,03/06/2025,No,Remove,03/06/2025,52.14262,-2.349091,WR13 5HB,ok
1684,Eaton Bishop Hereford,HR2 9QD,County of Herefordshire,26/02/2025,No,Remove,03/06/2025,No,Remove,03/06/2025,52.046944,-2.812903,HR2 9QD,ok
1685,Bulls Head Craswall Hereford,HR2 0PN,County of Herefordshire,26/02/2025,No,Remove,03/06/2025,No,Remove,03/06/2025,52.011258,-3.04228,HR2 0PN,ok
1686,Peterchurch Hereford,HR2 0RP,County of Herefordshire,26/02/2025,No,Remove,03/06/2025,No,Remove,03/06/2025,52.041328,-2.955001,HR2 0RP,ok
1687,Harewood End Hereford,HR2 8JT,County of Herefordshire,26/02/2025,No,Remove,03/06/2025,No,Remove,03/06/2025,51.939774,-2.68845,HR2 8JT,ok
1688,Ablington Bibury Cirencester,GL7 5NZ,Cotswold District,26/02/2025,No,Remove,02/06/2025,No,Remove,02/06/2025,51.767157,-1.855003,GL7 5NZ,ok
1689,P Nr Old Post Office Arlington Cirencester,GL7 5NL,Cotswold District,26/02/2025,No,Remove,02/06/2025,No,Remove,02/06/2025,51.759573,-1.838119,GL7 5NL,ok
1690,The Street Didmarton Badminton,GL9 1DT,Cotswold District,26/02/2025,No,Remove,02/06/2025,No,Remove,02/06/2025,51.585181,-2.262183,GL9 1DT,ok
1691,School Lane Cirencester,GL7 1JU,Cotswold District,26/02/2025,No,Remove,02/06/2025,No,Remove,02/06/2025,51.710145,-1.962445,GL7 1JU,ok
1692,Tescoutside Car Park Cripps Road Cirencester,GL7 1HN,Cotswold District,26/02/2025,No,Remove,02/06/2025,No,Remove,02/06/2025,51.71476,-1.969953,GL7 1HN,ok
1693,Sub Post Office Withington Road Andoversford Cheltenham,GL54 4LL,Cotswold District,26/02/2025,Yes,Retain,02/06/2025,No,Retain,02/06/2025,51.853583,-1.967364,GL54 4LL,ok
1694,Studfall Ave Clydesdale Road Corby,NN17 2DW,Corby District (B),26/02/2025,No,Remove,02/06/2025,No,Remove,02/06/2025,52.496433,-0.70844,NN17 2DW,ok
1695,Littleworth Chipping Campden,GL55 6BE,Cotswold District,26/02/2025,No,Remove,02/06/2025,No,Remove,02/06/2025,52.05029,-1.787667,GL55 6BE,ok
1696,Spitalgate Lane Cirencester,GL7 2DE,Cotswold District,26/02/2025,No,Remove,02/06/2025,No,Remove,02/06/2025,51.720092,-1.97008,GL7 2DE,ok
1697,Junction Shelah Rd Furnace Lane Halesowen,B63 3LU,Dudley District (B),27/02/2025,No,Remove,03/06/2025,No,Remove,03/06/2025,52.45528,-2.050867,B63 3LU,ok
1698,Fenton Street Brierley Hill,DY5 3HD,Dudley District (B),27/02/2025,No,Remove,03/06/2025,No,Remove,03/06/2025,52.482598,-2.12526,DY5 3HD,ok
1699,Nursery Road Broughty Ferry Dundee,DD5 3DU,Dundee City,27/02/2025,No,Remove,03/06/2025,No,Remove,03/06/2025,56.472524,-2.871559,DD5 3DU,ok
1700,Castle Street Broughty Ferry Dundee,DD5 2EJ,Dundee City,27/02/2025,No,Remove,03/06/2025,No,Remove,03/06/2025,56.465769,-2.863678,DD5 2EJ,ok
1701,Dalhousie Road Broughty Ferry Dundee,DD5 2SW,Dundee City,27/02/2025,No,Remove,03/06/2025,No,Remove,03/06/2025,56.473465,-2.84598,DD5 2SW,ok
1702,Magdalen Yard Road Dundee,DD1 4LQ,Dundee City,27/02/2025,No,Remove,03/06/2025,No,Remove,03/06/2025,56.453542,-2.98997,DD1 4LQ,ok
1703,Perth Road Dundee,DD2 1PY,Dundee City,27/02/2025,No,Remove,03/06/2025,No,Remove,03/06/2025,56.457489,-3.031564,DD2 1PY,ok
1704,King Street Broughty Ferry Dundee,DD5 1HE,Dundee City,27/02/2025,No,Remove,03/06/2025,No,Remove,03/06/2025,56.466746,-2.880694,DD5 1HE,ok
1705,1 Thurso Crescent Dundee,DD2 4AS,Dundee City,27/02/2025,No,Remove,03/06/2025,No,Remove,03/06/2025,56.466879,-3.049575,DD2 4AS,ok
1706,Benholm Place Dundee,DD3 9RT,Dundee City,27/02/2025,No,Remove,03/06/2025,No,Remove,03/06/2025,56.496608,-3.017277,DD3 9RT,ok
1707,Main Street Torrance Glasgow,G64 4EL,East Dunbartonshire,27/02/2025,No,Remove,03/06/2025,No,Remove,03/06/2025,55.938181,-4.212617,G64 4EL,ok
1708,Junction Balmuildy Rd / Adjacent No 97 Hilton Road Bishopbriggs Glasgow,G64 3EN,East Dunbartonshire,27/02/2025,No,Remove,03/06/2025,No,Remove,03/06/2025,55.913974,-4.227352,G64 3EN,ok
1709,Auchinairn P O Auchinairn Road Bishopbriggs Glasgow,G64 1NF,East Dunbartonshire,27/02/2025,No,Remove,03/06/2025,No,Remove,03/06/2025,55.898243,-4.215589,G64 1NF,ok
1710,Milngavie Road Bearsden Glasgow,G61 2HX,East Dunbartonshire,27/02/2025,No,Remove,03/06/2025,No,Remove,03/06/2025,55.910821,-4.322522,G61 2HX,ok
1711,Adj. No.124 Drymen Road Bearsden Glasgow,G61 3RB,East Dunbartonshire,27/02/2025,No,Remove,03/06/2025,No,Remove,03/06/2025,55.920256,-4.334066,G61 3RB,ok
1712,Adj. No.2 Kenmure Avenue Bishopbriggs Glasgow,G64 2RE,East Dunbartonshire,27/02/2025,No,Remove,03/06/2025,No,Remove,03/06/2025,55.904631,-4.225137,G64 2RE,ok
1713,Adj. No.5 Rannoch Drive Bearsden Glasgow,G61 2JW,East Dunbartonshire,27/02/2025,No,Remove,03/06/2025,No,Remove,03/06/2025,55.907602,-4.314505,G61 2JW,ok
1714,Entrance To Water Works Strathblane Road Milngavie Glasgow,G62 8DH,East Dunbartonshire,27/02/2025,No,Remove,03/06/2025,No,Remove,03/06/2025,55.943346,-4.310632,G62 8DH,ok
1715,Riverside Drive Dundee,DD1 4DB,Dundee City,27/02/2025,No,Remove,03/06/2025,No,Remove,03/06/2025,56.456575,-2.971065,DD1 4DB,ok
1716,Outside Noutside 15-21 Pco2 Stoneybank Terrace Musselburgh,EH21 6LY,East Lothian,03/03/2025,No,Remove,03/06/2025,No,Remove,03/06/2025,55.936581,-3.063411,EH21 6LY,ok
1717,1 Bayswell Road Dunbar,EH42 1AB,East Lothian,03/03/2025,No,Remove,03/06/2025,No,Remove,03/06/2025,56.003831,-2.519711,EH42 1AB,ok
1718,Stenton Pitcox Dunbar,EH42 1RQ,East Lothian,03/03/2025,No,Remove,03/06/2025,No,Remove,03/06/2025,55.968769,-2.573166,EH42 1RQ,ok
1719,Outside Co-Op Stores Bottoms Lane Birkenshaw Bradford,BD11 2HL,Kirklees District (B),03/03/2025,No,Remove,03/06/2025,No,Remove,03/06/2025,53.745381,-1.683185,BD11 2HL,ok
1720,Junction Of Halifax Rd/Birkdale Rd/ Newsome Street Dewsbury,WF13 4HE,Kirklees District (B),03/03/2025,No,Remove,03/06/2025,No,Remove,03/06/2025,53.697738,-1.639892,WF13 4HE,ok
1721,Hall Ing Lane Honley Holmfirth,HD9 6QR,Kirklees District (B),03/03/2025,No,Remove,03/06/2025,No,Remove,03/06/2025,53.604904,-1.774213,HD9 6QR,ok
1722,Outside No 10 Broad Lane Huddersfield,HD5 9BX,Kirklees District (B),03/03/2025,No,Remove,03/06/2025,No,Remove,03/06/2025,53.64555,-1.761215,HD5 9BX,ok
1723,Riddings Road Huddersfield,HD2 1HP,Kirklees District (B),03/03/2025,No,Remove,03/06/2025,No,Remove,03/06/2025,53.668657,-1.764581,HD2 1HP,ok
1724,Blackness Linlithgow,EH49 7NL,Falkirk,03/03/2025,No,Remove,03/06/2025,No,Remove,03/06/2025,56.003709,-3.522689,EH49 7NL,ok
1725,1 High Street Bonnybridge,FK4 1BX,Falkirk,03/03/2025,No,Remove,03/06/2025,No,Remove,03/06/2025,56.001173,-3.889053,FK4 1BX,ok
1726,Huddersfield Road Dewsbury,WF13 3JW,Kirklees District (B),03/03/2025,No,Remove,03/06/2025,No,Remove,03/06/2025,53.679552,-1.657457,WF13 3JW,ok
1727,Glasgow Road Dennyloanhead Bonnybridge,FK4 1QF,Falkirk,03/03/2025,No,Remove,03/06/2025,No,Remove,03/06/2025,55.998352,-3.910596,FK4 1QF,ok
1728,1 Brooke Street Grangemouth,FK3 8SY,Falkirk,03/03/2025,No,Remove,03/06/2025,No,Remove,03/06/2025,56.002589,-3.727704,FK3 8SY,ok
1729,Adj.Dental Sur.27E Links Road Port Seton Prestonpans,EH32 0DU,East Lothian,03/03/2025,No,Remove,03/06/2025,No,Remove,03/06/2025,55.972051,-2.951743,EH32 0DU,ok
1730,Opposite Mucklets Ave Whitehill Farm Road Musselburgh,EH21 6PJ,East Lothian,03/03/2025,No,Remove,03/06/2025,No,Remove,03/06/2025,55.934118,-3.069763,EH21 6PJ,ok
1731,Athelstaneford North Berwick,EH39 5BE,East Lothian,03/03/2025,No,Remove,03/06/2025,No,Remove,03/06/2025,55.986979,-2.748066,EH39 5BE,ok
1732,Drem North Berwick,EH39 5AP,East Lothian,03/03/2025,Yes,Remove,03/06/2025,No,Remove,03/06/2025,56.006194,-2.787599,EH39 5AP,ok
1733,Outside Shop Traprain Terrace Haddington,EH41 3QD,East Lothian,03/03/2025,No,Remove,03/06/2025,No,Remove,03/06/2025,55.95952,-2.771432,EH41 3QD,ok
1734,Haircraigs/Denny Rd Denny,FK6 5JX,Falkirk,03/03/2025,No,Remove,03/06/2025,No,Remove,03/06/2025,56.008525,-3.908212,FK6 5JX,ok
1735,Junction Moodie St Nethertown Broad Street Dunfermline,KY12 7DS,Fife,04/03/2025,No,Remove,04/06/2025,No,Remove,04/06/2025,56.06666,-3.458314,KY12 7DS,ok
1736,Junc Malcolm St St. Andrews Street Dunfermline,KY11 4QN,Fife,04/03/2025,No,Remove,04/06/2025,No,Remove,04/06/2025,56.063791,-3.444008,KY11 4QN,ok
1737,Craighead Crescent Newport-On-Tay,DD6 8DZ,Fife,04/03/2025,No,Remove,04/06/2025,No,Remove,04/06/2025,56.444072,-2.934411,DD6 8DZ,ok
1738,Junc Townhill Rd Donald Street Dunfermline,KY12 0BY,Fife,04/03/2025,No,Remove,04/06/2025,No,Remove,04/06/2025,56.081832,-3.445679,KY12 0BY,ok
1739,Woodhaven Terrace Wormit Newport-On-Tay,DD6 8LD,Fife,04/03/2025,No,Remove,04/06/2025,No,Remove,04/06/2025,56.43067,-2.963399,DD6 8LD,ok
1740,Outside Post Office The Square Tomintoul Ballindalloch,AB37 9ET,Moray,04/03/2025,Yes,Remove,04/06/2025,No,Remove,05/06/2025,57.251945,-3.378611,AB37 9ET,ok
1741,Hopelands Road Penicuik,EH26 9LH,Midlothian,04/03/2025,Yes,Retain,27/08/2025,No,Retain,27/08/2025,55.828378,-3.27266,EH26 9LH,ok
1742,Cupar Road Newport-On-Tay,DD6 8AF,Fife,04/03/2025,No,Remove,04/06/2025,No,Remove,04/06/2025,56.44024,-2.940967,DD6 8AF,ok
1743,Auchenhalrig Auchenhalrig Spey Bay Fochabers,IV32 7PP,Moray,04/03/2025,Yes,Retain,04/06/2025,No,Retain,04/06/2025,57.642263,-3.053809,IV32 7PP,ok
1744,Outside Post Office Seapark Forres,IV36 3TT,Moray,04/03/2025,No,Remove,04/06/2025,No,Remove,04/06/2025,57.634533,-3.572466,IV36 3TT,ok
1745,Outside Town Hall High Street Lossiemouth,IV31 6AA,Moray,04/03/2025,No,Remove,04/06/2025,No,Remove,04/06/2025,57.721706,-3.281942,IV31 6AA,ok
1746,Frances Row Boreland Dysart Kirkcaldy,KY1 2YL,Fife,04/03/2025,No,Remove,04/06/2025,No,Remove,04/06/2025,56.138861,-3.123573,KY1 2YL,ok
1747,Melrose Crescent Kirkcaldy,KY2 5BN,Fife,04/03/2025,No,Remove,04/06/2025,No,Remove,04/06/2025,56.121705,-3.158974,KY2 5BN,ok
1748,Junc Mid St St. Clair Street Kirkcaldy,KY1 2QE,Fife,04/03/2025,No,Remove,04/06/2025,No,Remove,04/06/2025,56.121674,-3.14202,KY1 2QE,ok
1749,Outside Telephone Exchange Canmore Street Dunfermline,KY12 7NU,Fife,04/03/2025,No,Remove,04/06/2025,No,Remove,04/06/2025,56.070214,-3.460151,KY12 7NU,ok
1750,Outside Police Station Main Street Newmills Dunfermline,KY12 8SS,Fife,04/03/2025,No,Remove,04/06/2025,No,Remove,04/06/2025,56.059637,-3.585421,KY12 8SS,ok
1751,South Row Charlestown Dunfermline,KY11 3EF,Fife,04/03/2025,No,Remove,04/06/2025,No,Remove,04/06/2025,56.036276,-3.498996,KY11 3EF,ok
1752,At St Lawrence St Belville Street Greenock,PA15 4UN,Inverclyde,04/03/2025,No,Remove,04/06/2025,No,Remove,04/06/2025,55.942047,-4.739088,PA15 4UN,ok
1753,Junc Tweedale Drive Aberdour Road Dunfermline,KY11 4PD,Fife,04/03/2025,No,Remove,04/06/2025,No,Remove,04/06/2025,56.06171,-3.441424,KY11 4PD,ok
1754,Main Street Hill Of Beath Cowdenbeath,KY4 8DP,Fife,04/03/2025,No,Remove,04/06/2025,No,Remove,04/06/2025,56.096041,-3.367301,KY4 8DP,ok
1755,Glebe Park Inverkeithing,KY11 1LT,Fife,04/03/2025,No,Remove,04/06/2025,No,Remove,04/06/2025,56.025741,-3.402313,KY11 1LT,ok
