id,address,postcode,public_body,removal_proposal_sent,public_body_representation_made,bt_initial_decision,bt_initial_decision_date,public_body_review_requested,bt_final_decision,bt_final_decision_date,latitude,longitude,geocoded_postcode,geocoding_status
2248,Opposite 51 Phoenix Rise Phoenix Rise Westbury,BA13 3XS,Wiltshire,17/03/2025,Yes,Remove,20/06/2025,No,Remove,20/06/2025,51.262172,-2.197781,BA13 3XS,ok
2249,Junction Of The Green London Road Calne,SN11 0AA,Wiltshire,17/03/2025,Yes,Remove,20/06/2025,No,Remove,20/06/2025,51.43402,-2.001584,SN11 0AA,ok
2250,Slaughterford Chippenham,SN14 8RD,Wiltshire,17/03/2025,No,Remove,20/06/2025,No,Remove,20/06/2025,51.468457,-2.220426,SN14 8RD,ok
2251,Lacock Road Corsham,SN13 9HS,Wiltshire,17/03/2025,No,Remove,20/06/2025,No,Remove,20/06/2025,51.430533,-2.182714,SN13 9HS,ok
2252,Havering Lane Milton Lilbourne Pewsey,SN9 5LJ,Wiltshire,17/03/2025,Yes,Retain,20/06/2025,No,Retain,20/06/2025,51.341284,-1.730299,SN9 5LJ,ok
2253,Church Hanborough Witney,OX29 8AB,West Oxfordshire District,17/03/2025,No,Remove,19/06/2025,No,Remove,19/06/2025,51.812189,-1.382232,OX29 8AB,ok
2254,Ford Chippenham,SN14 8RP,Wiltshire,17/03/2025,No,Remove,20/06/2025,No,Remove,20/06/2025,51.472379,-2.228939,SN14 8RP,ok
2255,Nt Parish Hall High Street Eynsham Witney,OX29 4HA,West Oxfordshire District,17/03/2025,Yes,Retain,19/06/2025,No,Retain,19/06/2025,51.780551,-1.374126,OX29 4HA,ok
2256,Kingsway Ossett,WF5 8DA,Wakefield District (B),17/03/2025,No,Remove,19/06/2025,No,Remove,19/06/2025,53.680455,-1.581873,WF5 8DA,ok
2257,Bartlow Road Ashdon Saffron Walden,CB10 2HR,Uttlesford District,17/03/2025,Yes,Retain,17/06/2025,No,Retain,17/06/2025,52.058792,0.313588,CB10 2HR,ok
2258,Junction Of Newport Rd Arkesden Road Clavering Saffron Walden,CB11 4QU,Uttlesford District,17/03/2025,No,Remove,17/06/2025,No,Remove,17/06/2025,51.974867,0.156605,CB11 4QU,ok
2259,Opposite 21 Town Street Thaxted Dunmow,CM6 2LD,Uttlesford District,17/03/2025,No,Remove,17/06/2025,No,Remove,17/06/2025,51.953214,0.344255,CM6 2LD,ok
2260,Burton End Stansted,CM24 8UE,Uttlesford District,17/03/2025,No,Remove,17/06/2025,No,Remove,17/06/2025,51.893981,0.216565,CM24 8UE,ok
2261,Opp.Garden Gate P.H Rickmansworth Road Chorleywood Rickmansworth,WD3 5SQ,Three Rivers District,17/03/2025,No,Remove,19/06/2025,No,Remove,19/06/2025,51.65844,-0.501941,WD3 5SQ,ok
2262,Adjacent To Post Box Heath Wakefield,WF1 5SN,Wakefield District (B),17/03/2025,No,Remove,19/06/2025,No,Remove,19/06/2025,53.675722,-1.465159,WF1 5SN,ok
2263,Swallow Crescent Innsworth Gloucester,GL3 1BN,Tewkesbury District (B),17/03/2025,Yes,Remove,16/06/2025,No,Remove,16/06/2025,51.886511,-2.206397,GL3 1BN,ok
2264,Wormington Broadway,WR12 7NL,Tewkesbury District (B),17/03/2025,No,Remove,16/06/2025,No,Remove,16/06/2025,52.025894,-1.943309,WR12 7NL,ok
2265,Lambert Gardens Shurdington Cheltenham,GL51 4SW,Tewkesbury District (B),17/03/2025,No,Remove,16/06/2025,No,Remove,16/06/2025,51.863425,-2.120145,GL51 4SW,ok
2266,Voxwell Lane Opposite Two Hedges Road Bishops Cleeve Cheltenham,GL52 8DT,Tewkesbury District (B),17/03/2025,No,Remove,16/06/2025,No,Remove,16/06/2025,51.942933,-2.061163,GL52 8DT,ok
2267,Gloucester Street Winchcombe Cheltenham,GL54 5LX,Tewkesbury District (B),17/03/2025,No,Remove,16/06/2025,No,Remove,16/06/2025,51.951955,-1.970669,GL54 5LX,ok
2268,Adjacent Village Hall Red Lion The Street Castle Eaton Swindon,SN6 6JZ,Swindon (B),17/03/2025,No,Remove,19/06/2025,No,Remove,19/06/2025,51.660737,-1.790978,SN6 6JZ,ok
2269,Nr Town Hall Market Square Bampton,OX18 2JH,West Oxfordshire District,17/03/2025,Yes,Remove,19/06/2025,Yes,Retain,11/12/2025,51.726329,-1.545299,OX18 2JH,ok
2270,Buckland Broadway,WR12 7LY,Tewkesbury District (B),17/03/2025,No,Remove,16/06/2025,No,Remove,16/06/2025,52.023315,-1.883254,WR12 7LY,ok
2271,Outside Ascalon House Ascalon Street London,SW8 4DL,Wandsworth London Borough,17/03/2025,No,Remove,17/06/2025,No,Remove,17/06/2025,51.477392,-0.142465,SW8 4DL,ok
2272,Snowshill High Street Broadway,WR12 7DU,Tewkesbury District (B),17/03/2025,Yes,Retain,16/06/2025,No,Retain,16/06/2025,52.036193,-1.861193,WR12 7DU,ok
2273,Outside 129 Beaumont Road London,SW19 6RY,Wandsworth London Borough,17/03/2025,No,Remove,17/06/2025,No,Remove,17/06/2025,51.448304,-0.215676,SW19 6RY,ok
2274,Junction Of Bessborough Rd Horndean Close London,SW15 4BE,Wandsworth London Borough,17/03/2025,No,Remove,17/06/2025,No,Remove,17/06/2025,51.447169,-0.239337,SW15 4BE,ok
2275,Swerford Park Lodge Swerford Chipping Norton,OX7 4AT,West Oxfordshire District,17/03/2025,No,Remove,19/06/2025,No,Remove,19/06/2025,51.979112,-1.471215,OX7 4AT,ok
2276,Outside Telephone Exchange High Street Skelmersdale,WN8 8AB,West Lancashire District (B),17/03/2025,No,Remove,19/06/2025,No,Remove,19/06/2025,53.548044,-2.790346,WN8 8AB,ok
2277,Trinity Methodist United Reform Church High Street Skelmersdale,WN8 8AT,West Lancashire District (B),17/03/2025,No,Remove,19/06/2025,No,Remove,19/06/2025,53.547558,-2.798592,WN8 8AT,ok
2278,Wayleave Pp1043 Princetown Yelverton,PL20 6SS,West Devon District (B),17/03/2025,Yes,Remove,17/06/2025,No,Remove,17/06/2025,50.556344,-4.017931,PL20 6SS,ok
2279,Cable Booster Station Merrivale Yelverton,PL20 6ST,West Devon District (B),17/03/2025,Yes,Remove,17/06/2025,Yes,Retain,11/12/2025,50.558429,-4.049902,PL20 6ST,ok
2280,Sampford Spiney Yelverton,PL20 6LD,West Devon District (B),17/03/2025,Yes,Remove,17/06/2025,Yes,Retain,11/12/2025,50.523995,-4.078038,PL20 6LD,ok
2281,Outside The Green Cross Cobbs Brow Lane Newburgh Wigan,WN8 7ND,West Lancashire District (B),17/03/2025,No,Remove,19/06/2025,No,Remove,19/06/2025,53.584805,-2.782437,WN8 7ND,ok
2282,Spo Peter Tavy Tavistock,PL19 9NN,West Devon District (B),17/03/2025,Yes,Remove,17/06/2025,No,Remove,17/06/2025,50.579687,-4.101126,PL19 9NN,ok
2283,The Square Chagford Newton Abbot,TQ13 8AB,West Devon District (B),17/03/2025,Yes,Remove,17/06/2025,No,Remove,17/06/2025,50.673041,-3.839814,TQ13 8AB,ok
2284,Drewsteignton Exeter,EX6 6PB,West Devon District (B),17/03/2025,No,Remove,17/06/2025,No,Remove,17/06/2025,50.699421,-3.809834,EX6 6PB,ok
2285,Broadwoodwidger Lifton,PL16 0JR,West Devon District (B),17/03/2025,Yes,Retain,17/06/2025,No,Retain,17/06/2025,50.68374,-4.26484,PL16 0JR,ok
2286,Beaworthy,EX21 5AB,West Devon District (B),17/03/2025,No,Remove,17/06/2025,No,Remove,17/06/2025,50.774392,-4.183783,EX21 5AB,ok
2287,Weir Quay Yelverton,PL20 7BT,West Devon District (B),17/03/2025,No,Remove,17/06/2025,No,Remove,17/06/2025,50.464347,-4.205937,PL20 7BT,ok
2288,Outside Post Office High Street Hungerford,RG17 0DP,West Berkshire,17/03/2025,Yes,Remove,17/06/2025,No,Remove,17/06/2025,51.415789,-1.514649,RG17 0DP,ok
2289,Junction Englefield Road Church Street Theale Reading,RG7 5BX,West Berkshire,17/03/2025,Yes,Remove,17/06/2025,No,Remove,17/06/2025,51.436215,-1.081127,RG7 5BX,ok
2290,Junction Of Maple Avenue. Oakwood Drive Ulverston,LA12 9JY,South Lakeland District,18/03/2025,No,Remove,19/06/2025,No,Remove,19/06/2025,54.182143,-3.094202,LA12 9JY,ok
2291,P Outside Wayside Cottage Coffinswell Newton Abbot,TQ12 4SN,Teignbridge District,18/03/2025,No,Remove,20/06/2025,No,Remove,20/06/2025,50.507347,-3.567447,TQ12 4SN,ok
2292,Broadhempston Totnes,TQ9 6BN,Teignbridge District,18/03/2025,No,Remove,20/06/2025,No,Remove,20/06/2025,50.484274,-3.691776,TQ9 6BN,ok
2293,Outside Shops/Midland Bank Pathfinder Village Exeter,EX6 6BT,Teignbridge District,18/03/2025,No,Remove,20/06/2025,No,Remove,20/06/2025,50.727409,-3.645315,EX6 6BT,ok
2294,Cockwood Exeter,EX6 8RA,Teignbridge District,18/03/2025,No,Remove,20/06/2025,No,Remove,20/06/2025,50.617036,-3.449253,EX6 8RA,ok
2295,Near Home Farm Mamhead Exeter,EX6 8HP,Teignbridge District,18/03/2025,No,Remove,20/06/2025,No,Remove,20/06/2025,50.618774,-3.502318,EX6 8HP,ok
2296,Opposite Ambleside Pier Waterhead Ambleside,LA22 0EY,South Lakeland District,18/03/2025,No,Remove,19/06/2025,No,Remove,19/06/2025,54.41961,-2.961804,LA22 0EY,ok
2297,Town Hall Old Exeter Street Chudleigh Newton Abbot,TQ13 0JT,Teignbridge District,18/03/2025,No,Remove,20/06/2025,No,Remove,20/06/2025,50.605326,-3.600434,TQ13 0JT,ok
2298,Dunsford Exeter,EX6 7AA,Teignbridge District,18/03/2025,No,Remove,20/06/2025,No,Remove,20/06/2025,50.690845,-3.681044,EX6 7AA,ok
2299,Red Lion Square Grasmere Ambleside,LA22 9SP,South Lakeland District,18/03/2025,No,Remove,19/06/2025,No,Remove,19/06/2025,54.458836,-3.02466,LA22 9SP,ok
2300,Adjacent To Holy Trinity Church. Howgill Sedbergh,LA10 5JD,South Lakeland District,18/03/2025,No,Remove,19/06/2025,No,Remove,19/06/2025,54.348799,-2.56966,LA10 5JD,ok
2301,Torver Coniston,LA21 8AZ,South Lakeland District,18/03/2025,No,Remove,19/06/2025,No,Remove,19/06/2025,54.338225,-3.102053,LA21 8AZ,ok
2302,Adjacent To Car Park Entrance. Ruskin Avenue Coniston,LA21 8EH,South Lakeland District,18/03/2025,No,Remove,19/06/2025,No,Remove,19/06/2025,54.368456,-3.072479,LA21 8EH,ok
2303,Brow Edge Road Backbarrow Ulverston,LA12 8PS,South Lakeland District,18/03/2025,No,Remove,19/06/2025,No,Remove,19/06/2025,54.255277,-2.987045,LA12 8PS,ok
2304,Adjacent Kents Bank Railway Stn. Kentsford Road Grange-Over-Sands,LA11 7BB,South Lakeland District,18/03/2025,No,Remove,19/06/2025,No,Remove,19/06/2025,54.175559,-2.923266,LA11 7BB,ok
2305,Stainton Kendal,LA8 0LQ,South Lakeland District,18/03/2025,No,Remove,19/06/2025,No,Remove,19/06/2025,54.266247,-2.73185,LA8 0LQ,ok
2306,Havera Sedbergh,LA10 5HD,South Lakeland District,18/03/2025,No,Remove,19/06/2025,No,Remove,19/06/2025,54.324719,-2.535148,LA10 5HD,ok
2307,Adjacent To Market Hall. Main Street Sedbergh,LA10 5BN,South Lakeland District,18/03/2025,No,Remove,19/06/2025,No,Remove,19/06/2025,54.32343,-2.529827,LA10 5BN,ok
2308,O/Side 89 Hallgarth Circle. Hallgarth Circle Kendal,LA9 5NU,South Lakeland District,18/03/2025,No,Remove,19/06/2025,No,Remove,19/06/2025,54.339485,-2.759377,LA9 5NU,ok
2309,Lay By Garnett Plain Selside Kendal,LA8 9JX,South Lakeland District,18/03/2025,No,Remove,19/06/2025,No,Remove,19/06/2025,54.384957,-2.727896,LA8 9JX,ok
2310,Fore Street Bishopsteignton Teignmouth,TQ14 9QR,Teignbridge District,18/03/2025,No,Remove,20/06/2025,No,Remove,20/06/2025,50.553527,-3.541477,TQ14 9QR,ok
2311,Nr To Toilet Block Car Park Stock Lane Grasmere Ambleside,LA22 9SJ,South Lakeland District,18/03/2025,No,Remove,19/06/2025,No,Remove,19/06/2025,54.456899,-3.021989,LA22 9SJ,ok
2312,Dunchideock Exeter,EX2 9TY,Teignbridge District,18/03/2025,No,Remove,20/06/2025,No,Remove,20/06/2025,50.671463,-3.587357,EX2 9TY,ok
2313,Listed Kiosk Somersal Herbert Ashbourne,DE6 5PD,Derbyshire Dales District,18/03/2025,No,Remove,19/06/2025,No,Remove,19/06/2025,52.91598,-1.794609,DE6 5PD,ok
2314,Longdown Exeter,EX6 7SR,Teignbridge District,18/03/2025,No,Remove,20/06/2025,No,Remove,20/06/2025,50.706914,-3.598695,EX6 7SR,ok
2315,Victory Hall Exminster Exeter,EX6 8BT,Teignbridge District,18/03/2025,No,Remove,20/06/2025,No,Remove,20/06/2025,50.677942,-3.49461,EX6 8BT,ok
2316,Alphonsus Street Ayres Rd Manchester,M16 7GS,Trafford District (B),18/03/2025,No,Remove,18/03/2025,No,Remove,18/03/2025,53.458451,-2.267614,M16 7GS,ok
2317,Calver Road Baslow Bakewell,DE45 1RP,Derbyshire Dales District,18/03/2025,No,Remove,19/06/2025,No,Remove,19/06/2025,53.248801,-1.625381,DE45 1RP,ok
2318,Near Church Listed Kiosk Snelston Ashbourne,DE6 2EP,Derbyshire Dales District,18/03/2025,No,Remove,19/06/2025,No,Remove,19/06/2025,52.987479,-1.77419,DE6 2EP,ok
2319,Outside Red Lion Hognaston Ashbourne,DE6 1PR,Derbyshire Dales District,18/03/2025,No,Remove,19/06/2025,No,Remove,19/06/2025,53.052401,-1.651908,DE6 1PR,ok
2320,Near Post Office Listed Kiosk Tissington Ashbourne,DE6 1RA,Derbyshire Dales District,18/03/2025,No,Remove,19/06/2025,No,Remove,19/06/2025,53.067312,-1.73918,DE6 1RA,ok
2321,Near Scouts Outdoor Centre Fenny Bentley Ashbourne,DE6 1LD,Derbyshire Dales District,18/03/2025,No,Remove,19/06/2025,No,Remove,19/06/2025,53.048046,-1.74219,DE6 1LD,ok
2322,Opposite The Bulls Head Inn Foolow Hope Valley,S32 5QR,Derbyshire Dales District,18/03/2025,No,Remove,19/06/2025,No,Remove,19/06/2025,53.287493,-1.715,S32 5QR,ok
2323,Holywell Lane Youlgrave Bakewell,DE45 1UT,Derbyshire Dales District,18/03/2025,No,Remove,19/06/2025,No,Remove,19/06/2025,53.174228,-1.687041,DE45 1UT,ok
2324,Junction Sand Lane Alms Road Doveridge Ashbourne,DE6 5JZ,Derbyshire Dales District,18/03/2025,No,Remove,19/06/2025,No,Remove,19/06/2025,52.903924,-1.821948,DE6 5JZ,ok
2325,Junction Brady Mead Horse Leaze London,E6 6WJ,Newham London Borough,18/03/2025,No,Remove,19/06/2025,No,Remove,19/06/2025,51.513142,0.066339,E6 6WJ,ok
2326,Next To Bus Stand Pier Road London,E16 2JJ,Newham London Borough,18/03/2025,No,Remove,19/06/2025,No,Remove,19/06/2025,51.499761,0.063241,E16 2JJ,ok
2327,Buckland-In-The-Moor Newton Abbot,TQ13 7HN,Teignbridge District,18/03/2025,No,Remove,20/06/2025,No,Remove,20/06/2025,50.543164,-3.804495,TQ13 7HN,ok
2328,The Dale Stoney Middleton Hope Valley,S32 4TF,Derbyshire Dales District,18/03/2025,No,Remove,19/06/2025,No,Remove,19/06/2025,53.2767,-1.660874,S32 4TF,ok
2329,Brecon Road Abergavenny,NP7 5UH,Sir Fynwy - Monmouthshire,19/03/2025,No,Remove,23/06/2025,No,Remove,23/06/2025,51.824865,-3.023258,NP7 5UH,ok
2330,Nr Gaerllwyd Farm Newchurch Chepstow,NP16 6DD,Sir Fynwy - Monmouthshire,19/03/2025,No,Remove,23/06/2025,No,Remove,23/06/2025,51.672815,-2.798814,NP16 6DD,ok
2331,Maryport Street Usk,NP15 1XP,Sir Fynwy - Monmouthshire,19/03/2025,No,Remove,23/06/2025,No,Remove,23/06/2025,51.699432,-2.900499,NP15 1XP,ok
2332,Bridge Street Usk,NP15 1BG,Sir Fynwy - Monmouthshire,19/03/2025,No,Remove,23/06/2025,No,Remove,23/06/2025,51.702733,-2.905051,NP15 1BG,ok
2333,Hereford Road Monmouth,NP25 3PB,Sir Fynwy - Monmouthshire,19/03/2025,No,Remove,23/06/2025,No,Remove,23/06/2025,51.8167,-2.712961,NP25 3PB,ok
2334,Nr Llanelly Church Abergavenny Road Gilwern Abergavenny,NP7 0AD,Sir Fynwy - Monmouthshire,19/03/2025,No,Remove,23/06/2025,No,Remove,23/06/2025,51.825097,-3.090518,NP7 0AD,ok
2335,Nr Bridge Inn Llanfoist Abergavenny,NP7 9LH,Sir Fynwy - Monmouthshire,19/03/2025,No,Remove,23/06/2025,No,Remove,23/06/2025,51.814962,-3.028909,NP7 9LH,ok
2336,Outside Car Park Goytre Arms Nantyderry Abergavenny,NP7 9DW,Sir Fynwy - Monmouthshire,19/03/2025,Yes,Remove,23/06/2025,No,Remove,23/06/2025,51.75003,-2.974427,NP7 9DW,ok
2337,Horncastle Road Roughton Moor Woodhall Spa,LN10 6UX,East Lindsey District,19/03/2025,No,Remove,23/06/2025,No,Remove,23/06/2025,53.162956,-0.178871,LN10 6UX,ok
2338,Opposite Hartington House The Broadway Woodhall Spa,LN10 6ST,East Lindsey District,19/03/2025,No,Remove,23/06/2025,No,Remove,23/06/2025,53.152597,-0.213197,LN10 6ST,ok
2339,Opposite Rose Cottage Thimbleby Horncastle,LN9 5RE,East Lindsey District,19/03/2025,Yes,Remove,23/06/2025,No,Remove,23/06/2025,53.212215,-0.149272,LN9 5RE,ok
2340,Grange Lane Utterby Louth,LN11 0TS,East Lindsey District,19/03/2025,Yes,Retain,23/06/2025,No,Retain,23/06/2025,53.422867,-0.031056,LN11 0TS,ok
2341,Market Place Binbrook Market Rasen,LN8 6DE,East Lindsey District,19/03/2025,No,Remove,23/06/2025,No,Remove,23/06/2025,53.428728,-0.180149,LN8 6DE,ok
2342,Outside Post Office Llanasa Holywell,CH8 9NB,Sir y Fflint - Flintshire,19/03/2025,No,Remove,23/06/2025,No,Remove,23/06/2025,53.322617,-3.343077,CH8 9NB,ok
2343,Roman Bank Coronation Road Ingoldmells Skegness,PE25 1JY,East Lindsey District,19/03/2025,No,Remove,23/06/2025,No,Remove,23/06/2025,53.189096,0.351212,PE25 1JY,ok
2344,Police Station New Shop Parade Greenfield Road Greenfield Holywell,CH8 7QS,Sir y Fflint - Flintshire,19/03/2025,No,Remove,23/06/2025,No,Remove,23/06/2025,53.288843,-3.210453,CH8 7QS,ok
2345,Junction Golf Road Quebec Road Mablethorpe,LN12 1QX,East Lindsey District,19/03/2025,No,Remove,23/06/2025,No,Remove,23/06/2025,53.351193,0.256188,LN12 1QX,ok
2346,A548 Connahs Quay Kelsterton Road Connahs Quay Deeside,CH5 4BJ,Sir y Fflint - Flintshire,19/03/2025,No,Remove,23/06/2025,No,Remove,23/06/2025,53.22701,-3.076852,CH5 4BJ,ok
2347,Strickland Street Shotton Deeside,CH5 1AL,Sir y Fflint - Flintshire,19/03/2025,No,Remove,23/06/2025,No,Remove,23/06/2025,53.20816,-3.039366,CH5 1AL,ok
2348,Outside Post Office Mancot Lane Mancot Deeside,CH5 2AH,Sir y Fflint - Flintshire,19/03/2025,No,Remove,23/06/2025,No,Remove,23/06/2025,53.195676,-3.021476,CH5 2AH,ok
2349,Junc South Parade Acton Lane London,W4 5HH,Ealing London Borough,19/03/2025,No,Remove,23/06/2025,No,Remove,23/06/2025,51.497892,-0.265607,W4 5HH,ok
2350,Junction Friary Ave Joseph Avenue Friary Park London,W3 6NL,Ealing London Borough,19/03/2025,No,Remove,23/06/2025,No,Remove,23/06/2025,51.516629,-0.263526,W3 6NL,ok
2351,Junction Hotspur Rd Union Road Northolt,UB5 6UB,Ealing London Borough,19/03/2025,No,Remove,23/06/2025,No,Remove,23/06/2025,51.536923,-0.368044,UB5 6UB,ok
2352,Adjacent Northfield Library Northfield Avenue London,W5 4UA,Ealing London Borough,19/03/2025,No,Remove,23/06/2025,No,Remove,23/06/2025,51.498267,-0.313511,W5 4UA,ok
2353,Junct Ruislip Rd Eastmead Avenue Greenford,UB6 9RE,Ealing London Borough,19/03/2025,No,Remove,23/06/2025,No,Remove,23/06/2025,51.532114,-0.362377,UB6 9RE,ok
2354,Selby Rd Swillington Common Leeds,LS15 4LD,Leeds District (B),19/03/2025,No,Remove,19/03/2025,No,Remove,19/03/2025,53.790002,-1.419767,LS15 4LD,ok
2355,Bryn Y Gwynt Holywell,CH8 7BX,Sir y Fflint - Flintshire,19/03/2025,No,Remove,23/06/2025,No,Remove,23/06/2025,53.276159,-3.209599,CH8 7BX,ok
2356,Dublin Road Junction Letalian Road Kilcoo Newry,BT34 5HU,"Newry, Mourne and Down",25/03/2025,No,Remove,25/06/2025,No,Remove,25/06/2025,54.235795,-6.029298,BT34 5HU,ok
2357,Church Square Rathfriland Newry,BT34 5PT,"Newry, Mourne and Down",25/03/2025,No,Remove,25/06/2025,No,Remove,25/06/2025,54.237563,-6.160977,BT34 5PT,ok
2358,Outside Poyntzpass Post Office Railway Street Poyntzpass Newry,BT35 6SN,"Newry, Mourne and Down",25/03/2025,No,Remove,25/06/2025,No,Remove,25/06/2025,54.292803,-6.374204,BT35 6SN,ok
2359,Forkhill Road Mullaghbawn Newry,BT35 9RA,"Newry, Mourne and Down",25/03/2025,No,Remove,25/06/2025,No,Remove,25/06/2025,54.10702,-6.476925,BT35 9RA,ok
2360,Opposite P.O. Rockview Crescent Belleeks Newry,BT35 7PQ,"Newry, Mourne and Down",25/03/2025,No,Remove,25/06/2025,No,Remove,25/06/2025,54.184681,-6.484502,BT35 7PQ,ok
2361,Clontigora / Outside No.15 / Oreilly Park Killeen Newry,BT35 8RP,"Newry, Mourne and Down",25/03/2025,No,Remove,25/06/2025,No,Remove,25/06/2025,54.123984,-6.338467,BT35 8RP,ok
2362,Outside No. 44 Armagh Road Newry,BT35 6DH,"Newry, Mourne and Down",25/03/2025,No,Remove,25/06/2025,No,Remove,25/06/2025,54.184703,-6.340337,BT35 6DH,ok
2363,Acorn Hill High Street Bessbrook Newry,BT35 7DY,"Newry, Mourne and Down",25/03/2025,No,Remove,25/06/2025,No,Remove,25/06/2025,54.190754,-6.388892,BT35 7DY,ok
2364,Armagh Road Newry,BT35 6NW,"Newry, Mourne and Down",25/03/2025,No,Remove,25/06/2025,No,Remove,25/06/2025,54.221679,-6.388884,BT35 6NW,ok
2365,Donagmore Road At Pillar Boxjunction Ringclare Road Newry,BT34 1JN,"Newry, Mourne and Down",25/03/2025,No,Remove,25/06/2025,No,Remove,25/06/2025,54.182334,-6.325604,BT34 1JN,ok
2366,Outside No.5 Orchard Villas Newry,BT34 2RA,"Newry, Mourne and Down",25/03/2025,No,Remove,25/06/2025,No,Remove,25/06/2025,54.206639,-6.294304,BT34 2RA,ok
2367,Outside No. 81 Main Avenue Newry,BT35 6HE,"Newry, Mourne and Down",25/03/2025,No,Remove,25/06/2025,No,Remove,25/06/2025,54.185209,-6.355575,BT35 6HE,ok
2368,2 Railway Road Junction Forkhill Road Killeavy Newry,BT35 8JT,"Newry, Mourne and Down",25/03/2025,No,Remove,25/06/2025,No,Remove,25/06/2025,54.122721,-6.389621,BT35 8JT,ok
2369,Castlewellan Road Ballyward Castlewellan,BT31 9RL,"Newry, Mourne and Down",25/03/2025,No,Remove,25/06/2025,No,Remove,25/06/2025,54.275471,-6.037384,BT31 9RL,ok
2370,Outside St. Marys Chapel Milltown Street Warrenpoint Newry,BT34 3PS,"Newry, Mourne and Down",25/03/2025,No,Remove,25/06/2025,No,Remove,25/06/2025,54.121955,-6.267209,BT34 3PS,ok
2371,Rooney Road Kilkeel Newry,BT34 4AG,"Newry, Mourne and Down",25/03/2025,No,Remove,25/06/2025,No,Remove,25/06/2025,54.063172,-6.000243,BT34 4AG,ok
2372,Newry Road Warrenpoint Newry,BT34 3LA,"Newry, Mourne and Down",25/03/2025,No,Remove,25/06/2025,No,Remove,25/06/2025,54.103818,-6.26691,BT34 3LA,ok
2373,96 Tandragee Road / Carrickvaddy Road,BT35 6LN,"Newry, Mourne and Down",25/03/2025,No,Remove,25/06/2025,No,Remove,25/06/2025,54.236338,-6.369876,BT35 6LN,ok
2374,Outside No. 84A / Glassdrumman Road Annalong Newry,BT34 4QJ,"Newry, Mourne and Down",25/03/2025,No,Remove,25/06/2025,No,Remove,25/06/2025,54.11035,-5.899213,BT34 4QJ,ok
2375,Ballynahinch Road Castlewellan,BT31 9PB,"Newry, Mourne and Down",25/03/2025,No,Remove,25/06/2025,No,Remove,25/06/2025,54.326104,-5.892608,BT31 9PB,ok
2376,Ballykilbeg Outside No 6 Ballykeel Road Downpatrick,BT30 8HX,"Newry, Mourne and Down",25/03/2025,No,Remove,25/06/2025,No,Remove,25/06/2025,54.292784,-5.786726,BT30 8HX,ok
2377,Woodgrange Road Downpatrick,BT30 8JE,"Newry, Mourne and Down",25/03/2025,Yes,Retain,25/06/2025,No,Retain,25/06/2025,54.32437,-5.774577,BT30 8JE,ok
2378,Main Street Clough Downpatrick,BT30 8RA,"Newry, Mourne and Down",25/03/2025,No,Remove,25/06/2025,No,Remove,25/06/2025,54.290817,-5.836751,BT30 8RA,ok
2379,Grovehill Kerry Wind Killyleagh Downpatrick,BT30 9RH,"Newry, Mourne and Down",25/03/2025,No,Remove,25/06/2025,No,Remove,25/06/2025,54.398362,-5.656593,BT30 9RH,ok
2380,Castle Street Junction The Square Strangford Downpatrick,BT30 7ND,"Newry, Mourne and Down",25/03/2025,No,Remove,25/06/2025,No,Remove,25/06/2025,54.370795,-5.556557,BT30 7ND,ok
2381,Downpatrick Street Saintfield Ballynahinch,BT24 7AY,"Newry, Mourne and Down",25/03/2025,No,Remove,25/06/2025,No,Remove,25/06/2025,54.45904,-5.831555,BT24 7AY,ok
2382,Opposite Cedar Hill Crossgar Road Ballynahinch,BT24 8EN,"Newry, Mourne and Down",25/03/2025,No,Remove,25/06/2025,No,Remove,25/06/2025,54.404168,-5.8905,BT24 8EN,ok
2383,Junction Of Drumnaquolie Road Mountain Road Ballynahinch,BT24 8QT,"Newry, Mourne and Down",25/03/2025,No,Remove,25/06/2025,No,Remove,25/06/2025,54.344245,-5.940417,BT24 8QT,ok
2384,Mcbrides Crossroads Moneyslane Road Ballyward Castlewellan,BT31 9PT,"Newry, Mourne and Down",25/03/2025,No,Remove,25/06/2025,No,Remove,25/06/2025,54.289596,-6.082573,BT31 9PT,ok
2385,Junction Burren Road Stewarts Road Dromara Dromore,BT25 2AN,Lisburn and Castlereagh,25/03/2025,No,Remove,25/06/2025,No,Remove,25/06/2025,54.391049,-5.979721,BT25 2AN,ok
2386,Outside No. 2 Abbey Park Scrogg Road Kilkeel Newry,BT34 4EF,"Newry, Mourne and Down",25/03/2025,No,Remove,25/06/2025,No,Remove,25/06/2025,54.059631,-6.021369,BT34 4EF,ok
2387,Junction Killaney Avenue Dromara Park Lisburn,BT28 1PX,Lisburn and Castlereagh,25/03/2025,No,Remove,25/06/2025,No,Remove,25/06/2025,54.506329,-6.063185,BT28 1PX,ok
2388,Rathfriland Road Dromara Dromore,BT25 2BH,Lisburn and Castlereagh,25/03/2025,No,Remove,25/06/2025,No,Remove,25/06/2025,54.379573,-6.018104,BT25 2BH,ok
2389,Blaisdon Lane Blaisdon Longhope,GL17 0AL,Forest of Dean District,25/03/2025,No,Remove,25/06/2025,No,Remove,25/06/2025,51.854821,-2.425831,GL17 0AL,ok
2390,Outside 220 Tates Avenue Belfast,BT12 6NB,Belfast City,25/03/2025,No,Remove,25/06/2025,No,Remove,25/06/2025,54.585239,-5.956969,BT12 6NB,ok
2391,Outside Church Off The Lower Kenilworth Place Belfast,BT4 1BH,Belfast City,25/03/2025,No,Remove,25/06/2025,No,Remove,25/06/2025,54.600851,-5.907345,BT4 1BH,ok
2392,Outside Mace Shop Hornbeam Rd Hornbeam Road Dunmurry Belfast,BT17 9DW,Belfast City,25/03/2025,No,Remove,25/06/2025,No,Remove,25/06/2025,54.537409,-6.013982,BT17 9DW,ok
2393,Junction Of Inverary Drive Station Road Belfast,BT4 1RE,Belfast City,25/03/2025,No,Remove,25/06/2025,No,Remove,25/06/2025,54.607044,-5.872433,BT4 1RE,ok
2394,Knockwood Park Belfast,BT5 6GA,Belfast City,25/03/2025,No,Remove,25/06/2025,No,Remove,25/06/2025,54.58559,-5.866435,BT5 6GA,ok
2395,Saintfield Road Belfast,BT8 6PD,Belfast City,25/03/2025,No,Remove,25/06/2025,No,Remove,25/06/2025,54.550711,-5.907163,BT8 6PD,ok
2396,Outside Co-Op Ballysillan Road Belfast,BT14 6RE,Belfast City,25/03/2025,No,Remove,25/06/2025,No,Remove,25/06/2025,54.630025,-5.962096,BT14 6RE,ok
2397,Plump Hill Mitcheldean,GL17 0ES,Forest of Dean District,25/03/2025,No,Remove,25/06/2025,No,Remove,25/06/2025,51.858116,-2.489505,GL17 0ES,ok
2398,Mount Merrion Gardens Belfast,BT6 0FW,Belfast City,25/03/2025,No,Remove,25/06/2025,No,Remove,25/06/2025,54.572697,-5.902479,BT6 0FW,ok
2399,Outside Post Office At No. 8 Queensway Carryduff Belfast,BT8 8NX,Belfast City,25/03/2025,No,Remove,25/06/2025,No,Remove,25/06/2025,54.517687,-5.888357,BT8 8NX,ok
2400,Junction Burntollet Way & The Straight Belfast,BT6 0EP,Belfast City,25/03/2025,No,Remove,25/06/2025,No,Remove,25/06/2025,54.572588,-5.896669,BT6 0EP,ok
2401,Ryan Park Belfast,BT5 7TY,Lisburn and Castlereagh,25/03/2025,No,Remove,25/06/2025,No,Remove,25/06/2025,54.564271,-5.862014,BT5 7TY,ok
2402,Skyline Drive Belsize Road Lisburn,BT27 4AL,Lisburn and Castlereagh,25/03/2025,No,Remove,25/06/2025,No,Remove,25/06/2025,54.519075,-6.037916,BT27 4AL,ok
2403,22 Tullynacross Road Den View Lisburn,BT27 5SF,Lisburn and Castlereagh,25/03/2025,No,Remove,25/06/2025,No,Remove,25/06/2025,54.522954,-6.015209,BT27 5SF,ok
2404,Outside 45 Comber Road Dundonald Belfast,BT16 2AA,Lisburn and Castlereagh,25/03/2025,No,Remove,25/06/2025,No,Remove,25/06/2025,54.593421,-5.812874,BT16 2AA,ok
2405,Soldierstown Road Aghalee Craigavon,BT67 0ER,Lisburn and Castlereagh,25/03/2025,No,Remove,25/06/2025,No,Remove,25/06/2025,54.51757,-6.261228,BT67 0ER,ok
2406,Main St(Aghalee Village) Aghalee Road Ballinderry Lower Lisburn,BT28 2JN,Lisburn and Castlereagh,25/03/2025,No,Remove,25/06/2025,No,Remove,25/06/2025,54.539916,-6.262596,BT28 2JN,ok
2407,Moss Road Lambeg Lisburn,BT27 4LE,Lisburn and Castlereagh,25/03/2025,No,Remove,25/06/2025,No,Remove,25/06/2025,54.531793,-6.03709,BT27 4LE,ok
