id,address,postcode,public_body,removal_proposal_sent,public_body_representation_made,bt_initial_decision,bt_initial_decision_date,public_body_review_requested,bt_final_decision,bt_final_decision_date,latitude,longitude,geocoded_postcode,geocoding_status
798,Westlea Gardens / Main Road Portavogie Newtownards,BT22 1DA,Ards and North Down,14/02/2024,No,Remove,11/06/2024,No,Remove,11/06/2024,54.472915,-5.454471,BT22 1DA,ok
799,Junction Of Demesne Road / Downshire Road Holywood,BT18 9LU,Ards and North Down,14/02/2024,No,Remove,11/06/2024,No,Remove,11/06/2024,54.639915,-5.836155,BT18 9LU,ok
800,High Street Ballyhalbert Newtownards,BT22 1BL,Ards and North Down,14/02/2024,No,Remove,11/06/2024,No,Remove,11/06/2024,54.494884,-5.462059,BT22 1BL,ok
801,Baylands First Avenue Bay Lands Bangor,BT20 5JT,Ards and North Down,14/02/2024,No,Remove,11/06/2024,No,Remove,11/06/2024,54.664211,-5.653335,BT20 5JT,ok
802,At Jctn. Moat Entry/Shore St Shore Street Donaghadee,BT21 0DG,Ards and North Down,14/02/2024,No,Remove,11/06/2024,No,Remove,11/06/2024,54.643802,-5.538713,BT21 0DG,ok
803,Moat Street Donaghadee,BT21 0DA,Ards and North Down,14/02/2024,No,Remove,11/06/2024,No,Remove,11/06/2024,54.64281,-5.53854,BT21 0DA,ok
804,Cottown / 93A Newtownards Road Donaghadee,BT21 0DY,Ards and North Down,14/02/2024,No,Remove,11/06/2024,No,Remove,11/06/2024,54.644235,-5.551655,BT21 0DY,ok
805,Outside 100 Abbey Ring Holywood,BT18 9PF,Ards and North Down,14/02/2024,No,Remove,11/06/2024,No,Remove,11/06/2024,54.632063,-5.838679,BT18 9PF,ok
806,Corner Of Hunts Pk And Killaughey Road Donaghadee,BT21 0BE,Ards and North Down,14/02/2024,No,Remove,11/06/2024,No,Remove,11/06/2024,54.637825,-5.537726,BT21 0BE,ok
807,Outside No. 46 Barnagh Pk Barnagh Park Donaghadee,BT21 0AN,Ards and North Down,14/02/2024,No,Remove,11/06/2024,No,Remove,11/06/2024,54.640432,-5.541798,BT21 0AN,ok
808,Hickory Avenue Newtownards,BT23 4HL,Ards and North Down,14/02/2024,No,Remove,11/06/2024,No,Remove,11/06/2024,54.60143,-5.695409,BT23 4HL,ok
809,Bangor West Halt Bryansburn Road Bangor,BT20 3RG,Ards and North Down,14/02/2024,No,Remove,11/06/2024,No,Remove,11/06/2024,54.660358,-5.691267,BT20 3RG,ok
810,Ashley Gardens Bangor,BT20 5RJ,Ards and North Down,14/02/2024,No,Remove,11/06/2024,No,Remove,11/06/2024,54.664732,-5.635773,BT20 5RJ,ok
811,Junction Darragh Road Linley Drive Comber Newtownards,BT23 5DB,Ards and North Down,14/02/2024,No,Remove,11/06/2024,No,Remove,11/06/2024,54.555818,-5.739121,BT23 5DB,ok
812,Junction Giffin St Deptford Church Street London,SE8 4RZ,Lewisham London Borough,19/02/2024,No,Remove,18/11/2024,No,Remove,18/11/2024,51.47607,-0.022634,SE8 4RZ,ok
813,Ballymartin Village Ballymartin Newry,BT34 4PA,"Newry, Mourne and Down",20/02/2024,No,Remove,05/06/2024,No,Remove,05/06/2024,54.080868,-5.951882,BT34 4PA,ok
814,Loyes Cross Rds / New Rd Dundalk Road Newtownhamilton Newry,BT35 0JA,"Newry, Mourne and Down",20/02/2024,No,Remove,05/06/2024,No,Remove,05/06/2024,54.175301,-6.579569,BT35 0JA,ok
815,Junction Of Of Bignian Ave & Carrigenagh Road Kilkeel Newry,BT34 4NE,"Newry, Mourne and Down",20/02/2024,No,Remove,05/06/2024,No,Remove,05/06/2024,54.07071,-5.990455,BT34 4NE,ok
816,The Square Newtownhamilton Newry,BT35 0AA,"Newry, Mourne and Down",20/02/2024,No,Remove,05/06/2024,No,Remove,05/06/2024,54.190784,-6.575974,BT35 0AA,ok
817,0/S Tele Exch - No 90 Tandragee Road Newry,BT35 6LN,"Newry, Mourne and Down",20/02/2024,No,Remove,05/06/2024,No,Remove,05/06/2024,54.236338,-6.369876,BT35 6LN,ok
818,Opp.No.53 Quayside Close Newry,BT35 8DQ,"Newry, Mourne and Down",20/02/2024,No,Remove,25/06/2025,No,Remove,25/06/2025,54.160856,-6.337617,BT35 8DQ,ok
819,Outside St Marys Chapel / Chapel Street Newry,BT34 2DN,"Newry, Mourne and Down",20/02/2024,No,Remove,05/06/2024,No,Remove,05/06/2024,54.168532,-6.333328,BT34 2DN,ok
820,Innisfree Park Newry,BT34 2LX,"Newry, Mourne and Down",20/02/2024,No,Remove,05/06/2024,No,Remove,05/06/2024,54.168412,-6.313105,BT34 2LX,ok
821,Drumalane Park Newry,BT35 8AS,"Newry, Mourne and Down",20/02/2024,No,Remove,05/06/2024,No,Remove,05/06/2024,54.164826,-6.340781,BT35 8AS,ok
822,Outside No. 5 Tievedoo Park Kilkeel Newry,BT34 4DJ,"Newry, Mourne and Down",20/02/2024,No,Remove,05/06/2024,No,Remove,05/06/2024,54.107949,-6.044635,BT34 4DJ,ok
823,Derryleckagh Road Newry,BT34 2NL,"Newry, Mourne and Down",20/02/2024,No,Remove,05/06/2024,No,Remove,05/06/2024,54.166532,-6.278621,BT34 2NL,ok
824,Drumsesk Pk Seaview Warrenpoint Newry,BT34 3NH,"Newry, Mourne and Down",20/02/2024,No,Remove,05/06/2024,No,Remove,05/06/2024,54.098308,-6.249988,BT34 3NH,ok
825,Outside No.11 Linnhurst Park Drumaness Ballynahinch,BT24 8RR,"Newry, Mourne and Down",20/02/2024,No,Remove,05/06/2024,No,Remove,05/06/2024,54.368339,-5.85459,BT24 8RR,ok
826,Outside No. 5 Annesley Court Central Promenade Newcastle,BT33 0EU,"Newry, Mourne and Down",20/02/2024,No,Remove,05/06/2024,No,Remove,05/06/2024,54.205068,-5.893059,BT33 0EU,ok
827,Tullybrannigan Road Newcastle,BT33 0DU,"Newry, Mourne and Down",20/02/2024,No,Remove,05/06/2024,No,Remove,05/06/2024,54.208539,-5.895764,BT33 0DU,ok
828,St. Pious Hill Lower Ballymartin Newry,BT34 4UG,"Newry, Mourne and Down",20/02/2024,No,Remove,05/06/2024,No,Remove,05/06/2024,54.093415,-5.934158,BT34 4UG,ok
829,Outside Ballyalton Po Ballyhornan Road Downpatrick,BT30 6RB,"Newry, Mourne and Down",20/02/2024,No,Remove,05/06/2024,No,Remove,05/06/2024,54.326593,-5.699142,BT30 6RB,ok
830,Ardmeen Green Downpatrick,BT30 6JJ,"Newry, Mourne and Down",20/02/2024,No,Remove,05/06/2024,No,Remove,05/06/2024,54.325748,-5.703325,BT30 6JJ,ok
831,Adj.To St.Dympnas Ave Flying Horse Road Downpatrick,BT30 6QW,"Newry, Mourne and Down",20/02/2024,No,Remove,05/06/2024,No,Remove,05/06/2024,54.319846,-5.700134,BT30 6QW,ok
832,Sloane Crescent Killyleagh Downpatrick,BT30 9RB,"Newry, Mourne and Down",20/02/2024,No,Remove,05/06/2024,No,Remove,05/06/2024,54.40549,-5.649301,BT30 9RB,ok
833,Station Rd /Downpatrick St Downpatrick Street Crossgar Downpatrick,BT30 9EA,"Newry, Mourne and Down",20/02/2024,No,Remove,05/06/2024,No,Remove,05/06/2024,54.396186,-5.761111,BT30 9EA,ok
834,Kilmore Village Crossgar Downpatrick,BT30 9HP,"Newry, Mourne and Down",20/02/2024,No,Remove,05/06/2024,No,Remove,05/06/2024,54.385424,-5.774891,BT30 9HP,ok
835,Opp. No.6 Lislea Drive Crossgar Downpatrick,BT30 9DB,"Newry, Mourne and Down",20/02/2024,No,Remove,05/06/2024,No,Remove,05/06/2024,54.398352,-5.760669,BT30 9DB,ok
836,Ballyhornan Village Ballyhornan Road Downpatrick,BT30 6RB,"Newry, Mourne and Down",20/02/2024,No,Remove,05/06/2024,No,Remove,05/06/2024,54.326593,-5.699142,BT30 6RB,ok
837,Bryansford Outside Post Office Main Street Newcastle,BT33 0AD,"Newry, Mourne and Down",20/02/2024,No,Remove,05/06/2024,No,Remove,05/06/2024,54.213848,-5.889025,BT33 0AD,ok
838,47 Main Rd Entrance To Industrial Estate Main Road Moygashel Dungannon,BT71 7QU,Mid Ulster,20/02/2024,No,Remove,02/07/2024,No,Remove,02/07/2024,54.484706,-6.752064,BT71 7QU,ok
839,Drains Bay/1Coast Road Larne,BT40 2LF,Mid and East Antrim,20/02/2024,No,Remove,24/06/2024,No,Remove,24/06/2024,54.878794,-5.83532,BT40 2LF,ok
840,Outside Edendork Primary School Coalisland Road Dungannon,BT71 4DP,Mid Ulster,20/02/2024,No,Remove,02/07/2024,No,Remove,02/07/2024,54.529533,-6.738864,BT71 4DP,ok
841,Outside No. 96 Orkney Drive Orkney Drive Ballymena,BT42 4ED,Mid and East Antrim,20/02/2024,No,Remove,24/06/2024,No,Remove,24/06/2024,54.859188,-6.252287,BT42 4ED,ok
842,Outside No.20 Dunclug Gdns Dunclug Gardens Ballymena,BT43 6NN,Mid and East Antrim,20/02/2024,No,Remove,24/06/2024,No,Remove,24/06/2024,54.88318,-6.270166,BT43 6NN,ok
843,Maine Park Sand Road Galgorm Ballymena,BT42 1DL,Mid and East Antrim,20/02/2024,No,Remove,24/06/2024,No,Remove,24/06/2024,54.862071,-6.319648,BT42 1DL,ok
844,Junction Larne Rd/Chichester Pk Chichester Park East Ballymena,BT42 4BH,Mid and East Antrim,20/02/2024,No,Remove,24/06/2024,No,Remove,24/06/2024,54.855338,-6.263822,BT42 4BH,ok
845,Adjacent Ballymena Tyres Warden Street Ballymena,BT43 7DR,Mid and East Antrim,20/02/2024,No,Remove,24/06/2024,No,Remove,24/06/2024,54.870301,-6.266699,BT43 7DR,ok
846,Opposite Cullybackey Refored Pres Main Street Cullybackey Ballymena,BT42 1BN,Mid and East Antrim,20/02/2024,No,Remove,24/06/2024,No,Remove,24/06/2024,54.887239,-6.350081,BT42 1BN,ok
847,Killmakevitt Crescent Kilmakevit Road Cullybackey Ballymena,BT42 1NH,Mid and East Antrim,20/02/2024,No,Remove,24/06/2024,No,Remove,24/06/2024,54.889814,-6.353825,BT42 1NH,ok
848,Opposite Mcneill Park Moorfields Road Ballymena,BT42 3BT,Mid and East Antrim,20/02/2024,No,Remove,24/06/2024,No,Remove,24/06/2024,54.84664,-6.233228,BT42 3BT,ok
849,Scotch Quarter Carrickfergus,BT38 7DP,Mid and East Antrim,20/02/2024,No,Remove,24/06/2024,No,Remove,24/06/2024,54.71802,-5.799556,BT38 7DP,ok
850,Belfast Road Carrickfergus,BT38 8BX,Mid and East Antrim,20/02/2024,No,Remove,24/06/2024,No,Remove,24/06/2024,54.710251,-5.828127,BT38 8BX,ok
851,Auto Exch Ballytober Road Islandmagee Larne,BT40 3RQ,Mid and East Antrim,20/02/2024,No,Remove,24/06/2024,No,Remove,24/06/2024,54.82539,-5.749054,BT40 3RQ,ok
852,Opposite 1 Shore Road Magheramorne Larne,BT40 3HW,Mid and East Antrim,20/02/2024,No,Remove,24/06/2024,No,Remove,24/06/2024,54.816882,-5.781797,BT40 3HW,ok
853,Outside No. 46 Sixtowns Road Draperstown Magherafelt,BT45 7BA,Mid Ulster,20/02/2024,No,Remove,02/07/2024,No,Remove,02/07/2024,54.790269,-6.791855,BT45 7BA,ok
854,The Square Stewartstown Dungannon,BT71 5HU,Mid Ulster,20/02/2024,No,Remove,02/07/2024,No,Remove,02/07/2024,54.576516,-6.675523,BT71 5HU,ok
855,Outside P. O. Browns Bay Road Islandmagee Larne,BT40 3RX,Mid and East Antrim,20/02/2024,No,Remove,24/06/2024,No,Remove,24/06/2024,54.850003,-5.75645,BT40 3RX,ok
856,Dunman Bridge Outside Dairy Moneymore Road Cookstown,BT80 8EH,Mid Ulster,20/02/2024,No,Remove,02/07/2024,No,Remove,02/07/2024,54.653503,-6.739861,BT80 8EH,ok
857,Outside No 3 Beechway Cookstown,BT80 8LG,Mid Ulster,20/02/2024,No,Remove,02/07/2024,No,Remove,02/07/2024,54.650998,-6.738311,BT80 8LG,ok
858,Main Street Windsor Terrace Coagh Cookstown,BT80 0ET,Mid Ulster,20/02/2024,No,Remove,02/07/2024,No,Remove,02/07/2024,54.647055,-6.613494,BT80 0ET,ok
859,Chapel Street Cookstown,BT80 8QB,Mid Ulster,20/02/2024,No,Remove,02/07/2024,No,Remove,02/07/2024,54.640903,-6.744634,BT80 8QB,ok
860,At Picnic Area Ballagh Road Clogher,BT76 0HE,Mid Ulster,20/02/2024,No,Remove,02/07/2024,No,Remove,02/07/2024,54.40865,-7.172544,BT76 0HE,ok
861,Aghintain Road Clogher,BT76 0UY,Mid Ulster,20/02/2024,No,Remove,02/07/2024,No,Remove,02/07/2024,54.422109,-7.220108,BT76 0UY,ok
862,Main Street Clogher,BT76 0AA,Mid Ulster,20/02/2024,No,Remove,02/07/2024,No,Remove,02/07/2024,54.411656,-7.17082,BT76 0AA,ok
863,Outside Post Office Littlebridge Road Moneymore Magherafelt,BT45 7NP,Mid Ulster,20/02/2024,No,Remove,02/07/2024,No,Remove,02/07/2024,54.652118,-6.626553,BT45 7NP,ok
864,Killymerron Park Dungannon,BT71 6DN,Mid Ulster,20/02/2024,No,Remove,02/07/2024,No,Remove,02/07/2024,54.50222,-6.756886,BT71 6DN,ok
865,Outside No.10 Dalriada Avenue Dalriada Avenue Cushendall Ballymena,BT44 0QE,Causeway Coast and Glens,21/02/2024,No,Remove,17/06/2024,No,Remove,17/06/2024,55.08024,-6.056211,BT44 0QE,ok
866,Roemill Gardens / Irish Green Street Limavady,BT49 9AA,Causeway Coast and Glens,21/02/2024,No,Remove,17/06/2024,No,Remove,17/06/2024,55.048898,-6.949676,BT49 9AA,ok
867,Portstewart Road Portrush,BT56 8EG,Causeway Coast and Glens,21/02/2024,No,Remove,17/06/2024,No,Remove,17/06/2024,55.198315,-6.655649,BT56 8EG,ok
868,Junction Artillery Rd / Cypress Drive Coleraine,BT52 2AF,Causeway Coast and Glens,21/02/2024,No,Remove,17/06/2024,No,Remove,17/06/2024,55.138794,-6.661462,BT52 2AF,ok
869,Outside Mountsandel Surgery Mountsandel Road Coleraine,BT52 1JB,Causeway Coast and Glens,21/02/2024,No,Remove,17/06/2024,No,Remove,17/06/2024,55.12723,-6.668574,BT52 1JB,ok
870,Carnany Park Ballymoney,BT53 7HU,Causeway Coast and Glens,21/02/2024,No,Remove,17/06/2024,No,Remove,17/06/2024,55.06896,-6.491753,BT53 7HU,ok
871,Cnr Of Armstrong Drive Alexandra Avenue Ballymoney,BT53 6ET,Causeway Coast and Glens,21/02/2024,No,Remove,17/06/2024,No,Remove,17/06/2024,55.074516,-6.509643,BT53 6ET,ok
872,Outside Telephone Exchange Main Street Dunloy Ballymena,BT44 9AA,Causeway Coast and Glens,21/02/2024,No,Remove,17/06/2024,No,Remove,17/06/2024,55.011554,-6.411886,BT44 9AA,ok
873,Outside No.1 Kilnadore Park Cushendall Ballymena,BT44 0NN,Causeway Coast and Glens,21/02/2024,No,Remove,17/06/2024,No,Remove,17/06/2024,55.077106,-6.061969,BT44 0NN,ok
874,At Waterfoot P O Main Street Glenariffe Ballymena,BT44 0QR,Causeway Coast and Glens,21/02/2024,No,Remove,17/06/2024,No,Remove,17/06/2024,55.060761,-6.059534,BT44 0QR,ok
875,Opposite No. 45 Moyle Road Ballycastle,BT54 6AN,Causeway Coast and Glens,21/02/2024,No,Remove,17/06/2024,No,Remove,17/06/2024,55.204581,-6.252782,BT54 6AN,ok
876,Outside No. 49 Whitepark Road Ballycastle,BT54 6LL,Causeway Coast and Glens,21/02/2024,No,Remove,17/06/2024,No,Remove,17/06/2024,55.209068,-6.277706,BT54 6LL,ok
877,Jctn Dalriada Gardens Coleraine Road Ballycastle,BT54 6DX,Causeway Coast and Glens,21/02/2024,No,Remove,17/06/2024,No,Remove,17/06/2024,55.198312,-6.261726,BT54 6DX,ok
878,Jcnt Fogarty Cres/Ramoan Rd Ramoan Road Ballycastle,BT54 6EG,Causeway Coast and Glens,21/02/2024,No,Remove,17/06/2024,No,Remove,17/06/2024,55.200151,-6.260217,BT54 6EG,ok
879,Turragh Outside Garage Glenshesk Road Armoy Ballymoney,BT53 8RJ,Causeway Coast and Glens,21/02/2024,No,Remove,17/06/2024,No,Remove,17/06/2024,55.132714,-6.320666,BT53 8RJ,ok
880,Glenshesk Road Armoy Ballymoney,BT53 8RJ,Causeway Coast and Glens,21/02/2024,No,Remove,17/06/2024,No,Remove,17/06/2024,55.132714,-6.320666,BT53 8RJ,ok
881,Car Park Feigh Causeway Road Bushmills,BT57 8SU,Causeway Coast and Glens,21/02/2024,No,Remove,17/06/2024,No,Remove,17/06/2024,55.230682,-6.515454,BT57 8SU,ok
882,Corner Atlantic Ave/Rathlin Atlantic Avenue Ballycastle,BT54 6AL,Causeway Coast and Glens,21/02/2024,No,Remove,17/06/2024,No,Remove,17/06/2024,55.205684,-6.250786,BT54 6AL,ok
883,"Trafalgar Rd Pottinger St, Ashton-Under-Lyne",OL7 0HD,Tameside District (B),22/02/2024,No,Remove,22/02/2024,No,Remove,22/05/2024,53.480038,-2.111163,OL7 0HD,ok
884,Outside Community Centre Keble Road Bicester,OX26 4TP,Cherwell District,24/02/2024,No,Remove,25/07/2025,No,Remove,25/07/2025,51.904644,-1.145923,OX26 4TP,ok
885,Outside Shops Holm Way Bicester,OX26 3YL,Cherwell District,24/02/2024,No,Remove,25/07/2025,No,Remove,25/07/2025,51.912873,-1.14994,OX26 3YL,ok
886,Osborne St Bredury Stockport,SK6 2BT,Stockport District (B),28/02/2024,No,Remove,28/02/2024,No,Remove,28/05/2024,53.416607,-2.128223,SK6 2BT,ok
887,Walton Hall Ave Stopgate Lane Liverpool,L11 7BY,Liverpool District (B),14/03/2024,No,Remove,14/03/2024,No,Remove,12/06/2024,53.450087,-2.938006,L11 7BY,ok
888,Walton Hall Ave Stopgate Lane Liverpool,L11 7BY,Liverpool District (B),14/03/2024,No,Remove,14/03/2024,No,Remove,12/06/2024,53.450087,-2.938006,L11 7BY,ok
889,Littleboy Drthornaby Stocton-On-Tees,TS17 8HB,Stockton-on-Tees (B),30/04/2024,No,Remove,30/04/2024,No,Remove,29/07/2024,54.549681,-1.288634,TS17 8HB,ok
890,"Piel St, Roa Island, Barrow-In-Furness",LA13 0QJ,Barrow-in-Furness District (B),15/05/2024,No,Remove,15/05/2024,No,Remove,15/05/2024,54.074339,-3.174516,LA13 0QJ,ok
891,Kirkstall Rd Leeds,LS3 1LH,Leeds District (B),04/06/2024,No,Remove,04/06/2024,No,Remove,02/09/2024,53.799116,-1.564222,LS3 1LH,ok
892,Glenochil King Omuirs Avenue Glenochil Village Alloa,FK10 3AH,Clackmannanshire,05/06/2024,No,Remove,17/09/2024,No,Remove,17/09/2024,56.140597,-3.812273,FK10 3AH,ok
893,Lochearnhead,FK19 8PX,Stirling,05/06/2024,No,Remove,19/09/2024,No,Remove,19/09/2024,56.381529,-4.288515,FK19 8PX,ok
894,Near Abbey Road Millar Place Stirling,FK8 1UX,Stirling,05/06/2024,No,Remove,19/09/2024,No,Remove,19/09/2024,56.124339,-3.929244,FK8 1UX,ok
895,Camp Place Callander,FK17 8DF,Stirling,05/06/2024,No,Remove,19/09/2024,No,Remove,19/09/2024,56.240165,-4.202883,FK17 8DF,ok
896,Ambleside Stalybridge,SK17 1EB,Tameside District (B),12/09/2024,No,Remove,12/09/2024,No,Remove,13/12/2024,53.262668,-1.912828,SK17 1EB,ok
897,Kestor Rd Longridge,PR3 3AD,Ribble Valley District (B),04/10/2024,No,Remove,04/10/2024,No,Remove,04/10/2024,53.828722,-2.606648,PR3 3AD,ok
898,Smithdown Lane Liverppol,L7 3PR,Liverpool District (B),14/10/2024,No,Remove,14/10/2024,No,Remove,14/01/2025,53.40414,-2.960129,L7 3PR,ok
899,Manchester Rd Eat Armitage Rd Salford,M38 0EA,Salford District (B),06/11/2024,No,Remove,06/11/2024,No,Remove,06/11/2024,53.529522,-2.425737,M38 0EA,ok
900,Village Green High Halden Ashford,TN26 3LP,Ashford District (B),14/11/2024,No,Remove,17/02/2025,No,Remove,17/02/2025,51.104168,0.713523,TN26 3LP,ok
901,Junction Olantigh Rd Scotton Street Wye Ashford,TN25 5BU,Ashford District (B),14/11/2024,No,Remove,17/02/2025,No,Remove,17/02/2025,51.183289,0.942033,TN25 5BU,ok
902,O S No 130 Nr Pde Of Shops Beach Green Shoreham-By-Sea,BN43 5YA,Adur District,14/11/2024,No,Remove,24/02/2025,No,Remove,24/02/2025,50.828778,-0.283745,BN43 5YA,ok
903,Entrance Herons Close Chilham Canterbury,CT4 8DN,Ashford District (B),14/11/2024,No,Remove,17/02/2025,No,Remove,17/02/2025,51.244195,0.965781,CT4 8DN,ok
904,Nr Car Park Market Place Charing Ashford,TN27 0LP,Ashford District (B),14/11/2024,No,Remove,17/02/2025,No,Remove,17/02/2025,51.210451,0.796131,TN27 0LP,ok
905,Junc Heathway Halbutt Street Dagenham,RM9 5AA,Barking and Dagenham,15/11/2024,No,Remove,17/02/2025,No,Remove,17/02/2025,51.553079,0.143029,RM9 5AA,ok
906,Junc Ripple Rd Upney Lane Barking,IG11 9LA,Barking and Dagenham,15/11/2024,No,Remove,17/02/2025,No,Remove,17/02/2025,51.545367,0.094524,IG11 9LA,ok
907,Junction Of Renwick Rd Ripple Road Dagenham,RM9 4QL,Barking and Dagenham,15/11/2024,No,Remove,17/02/2025,No,Remove,17/02/2025,51.533189,0.110676,RM9 4QL,ok
908,Outside Clinic Opposite Gale Street Porters Avenue Dagenham,RM8 2EQ,Barking and Dagenham,15/11/2024,No,Remove,17/02/2025,No,Remove,17/02/2025,51.545356,0.122633,RM8 2EQ,ok
909,Junction Of Of Bastable Ave Chelmer Crescent Barking,IG11 0QA,Barking and Dagenham,15/11/2024,No,Remove,17/02/2025,No,Remove,17/02/2025,51.527438,0.113424,IG11 0QA,ok
910,C/O Broad St Heathway Dagenham,RM10 7RU,Barking and Dagenham,15/11/2024,No,Remove,17/02/2025,No,Remove,17/02/2025,51.556186,0.147258,RM10 7RU,ok
911,The Street Ickham Canterbury,CT3 1QT,Canterbury District (B),19/11/2024,No,Remove,18/02/2025,No,Remove,18/02/2025,51.27765,1.184671,CT3 1QT,ok
912,Ye Olde Sportsman Faversham Road Seasalter Whitstable,CT5 4BP,Canterbury District (B),19/11/2024,No,Remove,18/02/2025,No,Remove,18/02/2025,51.343912,0.958892,CT5 4BP,ok
913,Junction Essex Avenue Hampton Pier Avenue Herne Bay,CT6 8DY,Canterbury District (B),19/11/2024,No,Remove,18/02/2025,No,Remove,18/02/2025,51.366936,1.099062,CT6 8DY,ok
914,Junction Alvis Ave Daytona Way Herne Bay,CT6 8AP,Canterbury District (B),19/11/2024,No,Remove,18/02/2025,No,Remove,18/02/2025,51.367141,1.089923,CT6 8AP,ok
915,O S Garlinge Cot Garlinge Gn Garlinge Green Canterbury,CT4 5RT,Canterbury District (B),19/11/2024,No,Remove,18/02/2025,No,Remove,18/02/2025,51.233796,1.026604,CT4 5RT,ok
916,Outside Post Office 1 High Street Littlebourne Canterbury,CT3 1ST,Canterbury District (B),19/11/2024,No,Remove,18/02/2025,No,Remove,18/02/2025,51.273257,1.165568,CT3 1ST,ok
917,Outside Post Office The Street Bishopsbourne Canterbury,CT4 5HZ,Canterbury District (B),19/11/2024,No,Remove,18/02/2025,No,Remove,18/02/2025,51.229065,1.136201,CT4 5HZ,ok
918,At Tarpots Corner Pco3 London Road Benfleet,SS7 5UH,Castle Point District (B),19/11/2024,No,Remove,18/02/2025,No,Remove,18/02/2025,51.567604,0.551641,SS7 5UH,ok
919,Opposite 38 Dovervelt Road Canvey Island,SS8 8DY,Castle Point District (B),19/11/2024,No,Remove,18/02/2025,No,Remove,18/02/2025,51.526786,0.598985,SS8 8DY,ok
920,Opposite Monico Ph Eastern Esplanade Canvey Island,SS8 7DN,Castle Point District (B),19/11/2024,No,Remove,18/02/2025,No,Remove,18/02/2025,51.512908,0.598195,SS8 7DN,ok
921,Adjacent Garages Nr Mascalls Way Mascalls Way Chelmsford,CM2 7NR,Chelmsford District (B),19/11/2024,No,Remove,18/02/2025,No,Remove,18/02/2025,51.724168,0.492737,CM2 7NR,ok
922,Outside Post Office The Tye East Hanningfield Chelmsford,CM3 8AA,Chelmsford District (B),19/11/2024,No,Remove,18/02/2025,No,Remove,18/02/2025,51.679944,0.560615,CM3 8AA,ok
923,Junction Wantz Rd Main Road Margaretting Ingatestone,CM4 9HX,Chelmsford District (B),19/11/2024,No,Remove,18/02/2025,No,Remove,18/02/2025,51.689407,0.415717,CM4 9HX,ok
924,Outside Tesco Highwoods Square Highwoods Colchester,CO4 9ED,Colchester District (B),19/11/2024,No,Remove,18/02/2025,No,Remove,18/02/2025,51.910162,0.919745,CO4 9ED,ok
925,Rear Of 3 Wooding Grove Creasys Drive Crawley,RH11 9HH,Crawley District (B),19/11/2024,No,Remove,18/02/2025,No,Remove,18/02/2025,51.095714,-0.208785,RH11 9HH,ok
926,Outside No 141 Woodfield Road Crawley,RH10 8EG,Crawley District (B),19/11/2024,No,Remove,18/02/2025,No,Remove,18/02/2025,51.124402,-0.176794,RH10 8EG,ok
927,Nr Supermarket And 1A And 2A Dobbins Place Ifield Crawley,RH11 0SZ,Crawley District (B),19/11/2024,No,Remove,18/02/2025,No,Remove,18/02/2025,51.111888,-0.229789,RH11 0SZ,ok
928,Near Noutside 2 - 12 Dorsten Square Crawley,RH11 8XW,Crawley District (B),19/11/2024,No,Remove,18/02/2025,No,Remove,18/02/2025,51.103776,-0.222071,RH11 8XW,ok
929,Near To Tavern On The Green Peterhouse Parade Crawley,RH10 3BA,Crawley District (B),19/11/2024,No,Remove,18/02/2025,No,Remove,18/02/2025,51.127338,-0.155298,RH10 3BA,ok
930,Arnhem Drve Jcn Of Milne Pk Est Arnhem Drive New Addington Croydon,CR0 0EA,Croydon London Borough,19/11/2024,No,Remove,19/02/2025,No,Remove,19/02/2025,51.339354,-0.010474,CR0 0EA,ok
931,Outside 347-349 Co-Op Supermkt Limpsfield Road South Croydon,CR2 9BY,Croydon London Borough,19/11/2024,No,Remove,19/02/2025,No,Remove,19/02/2025,51.319714,-0.064268,CR2 9BY,ok
932,Outside 29 High Street Lode Cambridge,CB25 9EW,East Cambridgeshire District,19/11/2024,No,Remove,20/02/2025,No,Remove,20/02/2025,52.241545,0.244219,CB25 9EW,ok
933,Outside Red Lion High Street Soham Ely,CB7 5HA,East Cambridgeshire District,19/11/2024,No,Remove,20/02/2025,No,Remove,20/02/2025,52.332432,0.338144,CB7 5HA,ok
934,Fair Green Reach Cambridge,CB25 0JD,East Cambridgeshire District,19/11/2024,No,Remove,20/02/2025,No,Remove,20/02/2025,52.271676,0.295297,CB25 0JD,ok
935,Outside No 116 Wish Hill Eastbourne,BN20 9HL,Eastbourne District (B),19/11/2024,No,Remove,19/02/2025,No,Remove,19/02/2025,50.798465,0.251271,BN20 9HL,ok
936,Outside No 4 Compton Street Eastbourne,BN21 4BB,Eastbourne District (B),19/11/2024,No,Remove,19/02/2025,No,Remove,19/02/2025,50.764455,0.28661,BN21 4BB,ok
937,Nr Entrance To Princes Park Royal Parade Eastbourne,BN22 7LH,Eastbourne District (B),19/11/2024,No,Remove,19/02/2025,No,Remove,19/02/2025,50.778291,0.306535,BN22 7LH,ok
938,Junction Of High Street Anerley Park London,SE20 8NY,Bromley London Borough,19/11/2024,No,Remove,18/02/2025,No,Remove,18/02/2025,51.417677,-0.060737,SE20 8NY,ok
939,Outside 57 High St/Sherwood Way High Street West Wickham,BR4 0LS,Bromley London Borough,19/11/2024,No,Remove,18/02/2025,No,Remove,18/02/2025,51.376308,-0.018615,BR4 0LS,ok
940,Nr Tennis Courts St. Annes Road Whitstable,CT5 2DN,Canterbury District (B),19/11/2024,No,Remove,18/02/2025,No,Remove,18/02/2025,51.363974,1.04221,CT5 2DN,ok
941,Junction Of Shortlands/Bromley Rd Bromley Road Bromley,BR1 4PJ,Bromley London Borough,19/11/2024,No,Remove,18/02/2025,No,Remove,18/02/2025,51.426061,-0.005691,BR1 4PJ,ok
942,Broadholme Lane Belper,DE56 2JF,Amber Valley District (B),19/11/2024,No,Remove,18/02/2025,No,Remove,18/02/2025,53.039852,-1.479348,DE56 2JF,ok
943,Junction Dale Road Sancroft Road Spondon Derby,DE21 7ES,City of Derby (B),19/11/2024,No,Remove,18/02/2025,No,Remove,18/02/2025,52.926701,-1.400467,DE21 7ES,ok
944,Outside Brookfields Barnack Road Bainton Stamford,PE9 3AE,City of Peterborough (B),19/11/2024,No,Remove,18/02/2025,No,Remove,18/02/2025,52.640081,-0.386258,PE9 3AE,ok
945,Nr Marchington Hall Marchington Uttoxeter,ST14 8LH,East Staffordshire District (B),19/11/2024,Yes,Retain,19/02/2025,No,Retain,24/02/2025,52.875726,-1.800802,ST14 8LH,ok
946,Leighton Close Uttoxeter,ST14 8SJ,East Staffordshire District (B),19/11/2024,No,Remove,19/02/2025,No,Remove,19/02/2025,52.892506,-1.861413,ST14 8SJ,ok
947,Outside No 84 Pennycroft Road Uttoxeter,ST14 7ET,East Staffordshire District (B),19/11/2024,No,Remove,19/02/2025,No,Remove,19/02/2025,52.904266,-1.880406,ST14 7ET,ok
948,Somerton Bury St. Edmunds,IP29 4ND,Babergh District,19/11/2024,No,Remove,18/02/2025,No,Remove,18/02/2025,52.145669,0.646255,IP29 4ND,ok
949,Opposite Farthings Cross Green Cockfield Bury St. Edmunds,IP30 0LG,Babergh District,19/11/2024,No,Remove,18/02/2025,No,Remove,18/02/2025,52.166136,0.771177,IP30 0LG,ok
950,Opposite War Memorial Market Place Bildeston Ipswich,IP7 7EN,Babergh District,19/11/2024,No,Remove,18/02/2025,No,Remove,18/02/2025,52.107612,0.908008,IP7 7EN,ok
951,Opposite Brett Cottage The Street Chelsworth Ipswich,IP7 7HU,Babergh District,19/11/2024,No,Remove,18/02/2025,No,Remove,18/02/2025,52.095871,0.889912,IP7 7HU,ok
952,Ent To Playing Fld Opposite 20-24 Corkscrew Hill West Wickham,BR4 9BA,Bromley London Borough,19/11/2024,No,Remove,18/02/2025,No,Remove,18/02/2025,51.370982,-0.010498,BR4 9BA,ok
953,Nr D.E.R.Shop/No.64 Newland Street Witham,CM8 1AH,Braintree District,19/11/2024,No,Remove,18/02/2025,No,Remove,18/02/2025,51.798986,0.638806,CM8 1AH,ok
954,Near Cricketers Inn West Street Coggeshall Colchester,CO6 1NL,Braintree District,19/11/2024,No,Remove,18/02/2025,No,Remove,18/02/2025,51.870831,0.684694,CO6 1NL,ok
